artsy_id,artsy_slug,artsy_url,name,type,definition
504fb4584ed2d60002000344,abstract-art,http://artsy.net/gene/abstract-art,Abstract Art,Broad Category,"_“It is well to remember that a picture, before being a battle horse, a nude woman or some anecdote, is essentially a flat surface covered with colours assembled in a certain order.” —[Maurice Denis](/artist/maurice-denis)_

While abstraction is evident around the world in art and functional objects, its art-historical significance is as a category for 20th-century Western art that moved away from the faithful representation of nature. The origins of abstraction are commonly located in the works of [J.M.W. Turner](/artist/joseph-mallord-william-turner), [Gustave Courbet](/artist/gustave-courbet), [Édouard Manet](/artist/edouard-manet), the [Impressionists](/gene/impressionism), as well as in the early 1900s, when [Paul Cézanne](/artist/paul-cezanne)'s stylized, flattened forms influenced what would eventually be called the [Cubism](/gene/cubism) of [Pablo Picasso](/artist/pablo-picass) and [Georges Braque](artist/georges-braque). Arguably the first abstract art movement, Cubism would prove foundational to countless branches of abstract art, including [Futurism](/gene/futurism) in Italy, the non-objective abstraction of [Wassily Kandinsky](/artist/wassily-kandinsky), [Kasimir Malevich](/artist/kasimir-malevich), and [Piet Mondrian](/artist/piet-mondrian), and the [Purism](/gene/purism) of [Le Corbusier](/artist/le-corbusier) and [Amédée Ozenfant](/artist/amedee-ozenfant). Though the intervening decades have seen returns to representation in different movements, virtually all of the dominant art forms of the latter half of the 20th century—including [Abstract Expressionism](/gene/abstract-expressionism), [Neo-Dada](/gene/neo-dada), [Pop Art](/gene/pop-art), [Minimalism](/gene/minimalism), and [Conceptual Art](/gene/conceptual-art)—have embraced the power and aesthetic of formal abstraction in lieu of literal representation.
"
4fbaba908b313700010006b2,abstract-painting,http://artsy.net/gene/abstract-painting,Abstract Painting,Broad Category,"Though traces of abstraction in two-dimensional art date back to the stone ages, abstract painting is popularly understood to have begun with the works of [J.M.W. Turner](/artist/joseph-mallord-william-turner), [Gustave Courbet](/artist/gustave-courbet), [Édouard Manet](/artist/edouard-manet), the [Impressionists](/gene/impressionism), as well as in the early 1900s, when [Paul Cézanne](/artist/paul-cezanne)'s stylized, flattened forms influenced what would eventually be called the [Cubism](/gene/cubism) of [Pablo Picasso](/artist/pablo-picasso) and [Georges Braque](artist/georges-braque). Arguably the first [abstract art](/gene/abstract-art) movement, Cubism would prove foundational to countless branches of abstract art, particularly those which lacked any recognizable link to the visible world. [Wassily Kandinsky](/artist/wassily-kandinsky) and [Robert Delaunay](/artist/robert-delaunay) were among the first artists to make such paintings: pure compositions of line, form, and color. While these early artists broke the ice for entirely abstract art, they were just a few among its many important early exponents, which also included [Marcel Duchamp](/artist/marcel-duchamp), [Francis Picabia](/artist/francis-picabia), [Piet Mondrian](/artist/piet-mondrian), and [Kazimir Malevich](/artist/kasimir-severinovich-malevich)."
4ef4f7855bd32e0001005ade,abstract-sculpture,http://artsy.net/gene/abstract-sculpture,Abstract Sculpture,Broad Category,"_""What is real is not the external form but the essence of things. Starting from this truth it is impossible for anyone to express anything essentially real by imitating its exterior surface."" —[Constantin Brancusi](/artist/constantin-brancusi)_

In the early 20th century, many avant-garde sculptors pushed the bounds of accepted modes of representation, abandoning faithfulness to the visible world in favor of abstraction. The question many artists asked was no longer how to reproduce the world as it appeared, but rather how to best express realities of life (sensed and theorized) through forms. Ever since, abstract sculpture has offered particularly fertile ground for experiments in shape, proportion, and technique, as well as for the embrace of non-traditional sculpting methods (apart from casting, welding, or direct carving), such as industrial manufacturing processes, plastic moulds, and even [3D printing](/gene/3d-printed). Modern strands of abstract sculpture include [Concrete Art](/gene/concrete-art)'s mathematically precise and elegant forms, the strict geometry and forceful presence of [Minimalist](/gene/minimalism) objects, and [Kinetic Sculpture](/gene/kinetic-sculpture)'s embodiment of movement and physical forces."
505b5a9b930ad000020008e0,abstract-versus-figurative,http://artsy.net/gene/abstract-versus-figurative,Abstract versus Figurative,Broad Category,"_“There is no abstract art. You must always start with something. Afterward you can remove all traces of reality.” —[Pablo Picasso](/artist/pablo-picasso)_

Of all the art battles and debates of the 20th century, none has been as divisive as that between abstract and figurative art. With the emergence of [Cubism](/gene/cubism) and the movements and artists that followed it, as well as the writings of American critics like Clement Greenberg, the progression towards a non-objective abstraction (wherein no objects could be recognized) became the dominant story of modern art; in turn, figuration became discredited, labeled as retrograde and aligned with enemy politics (read: Communism and [Socialist Realism](/gene/socialist-realism), or the National Socialist dictate of figurative art). Yet in reality, for many artists throughout the 20th century and into the present day, the dividing line between abstraction and figuration was much more porous, leading these artists to create paintings and works on paper somewhere in between the two. In the immediate post-war period in Europe, [Francis Bacon](/artist/francis-bacon) walked what he called the “tightrope between abstraction and figuration” to ask existential questions about the image of man, while contemporary artists like [Cecily Brown](/artist/cecily-brown) continue the tradition of [Willem de Kooning](/artist/willem-de-kooning), pushing their figures even closer to complete abstraction."
520baa99a09a678af00000cc,figurative-art,http://artsy.net/gene/figurative-art,Figurative Art,Broad Category,"A general category for artworks that represent recognizable material in the visible world, as opposed to abstract art. The variety of approaches to figurative art is enormous and almost as diverse as the history of art itself. In painting, figuration ranges from [Photorealism](/gene/photorealism) (like that of [Chuck Close](/artist/chuck-close)) at one end of the spectrum to nearly abstract (like Pablo Picasso’s Analytic Cubism) at the other. For much of the 20th century, figurative painting was largely ignored by the Western avant-garde, but the course changed with the 1980s emergence of figurative painters like [Anselm Kiefer](/artist/anselm-kiefer), [Jean-Michel Basquiat](/artist/jean-michel-basquiat), and [David Salle](/artist/david-salle)."
4fbabaa5be12d400010007c4,figurative-painting,http://artsy.net/gene/figurative-painting,Figurative Painting,Broad Category,"Paintings that represent recognizable things in the visible world, as opposed to abstract painting. The variety of approaches to figurative painting is enormous, and almost as diverse as the history of art itself. The two poles are, essentially, stylistic: [Photorealism](/gene/photorealistic) (like that of [Chuck Close](/artist/chuck-close)) at one extreme, and nearly abstract and unrecognizable figuration (like [Pablo Picasso](/artist/pablo-picasso)'s Analytic [Cubism](/gene/cubism)) at the other. While for much of the 20th century figurative painting was largely ignored by the Western avant-garde, the course changed with the 1980s emergence of figurative painters like [Anselm Kiefer](/artist/anselm-kiefer), [Jean-Michel Basquiat](/artist/jean-michel-basquiat), and [David Salle](/artist/david-salle); this renewed interest in turn shed light on figurative painters who had long been working in the same vein, from [Lucian Freud](/artist/lucian-freud) and [Alice Neel](/artist/alice-neel) to [Alex Katz](/artist/alex-katz), [Gerhard Richter](/artist/gerhard-richter), and countless others. Today, painters like [John Currin](/artist/john-currin), [Kehinde Wiley](/artist/kehinde-wiley), [Jenny Saville](/artist/jenny-saville), and [Elizabeth Peyton](/artist/elizabeth-peyton) represent the various approaches to figurative work."
4d90d196dcdd5f44a50000c0,figurative-sculpture,http://artsy.net/gene/figurative-sculpture,Figurative Sculpture,Broad Category,"Sculptures that represent the visible world. While the term figurative sculpture is generally associated with historical works created in traditional materials such as marble or bronze, such as the [_Venus de Milo_](/artwork/aphrodite-of-melos-called-venus-de-milo), Michelangelo's [_David_](/artwork/michelangelo-buonarroti-david-1), or [Auguste Rodin's](/artist/auguste-rodin) _The Thinker_, contemporary artists continue to explore its wide range of possibilities through a variety of new techniques and materials. Importantly, there is no strict division between figurative and abstract sculpture. Many works deemed figurative—especially those made in the 20th century—have abstract elements, and vice versa."
4e6a4315ec5e520001072274,myth-slash-religion,http://artsy.net/gene/myth-slash-religion,Myth/Religion,Broad Concept,A general category for artworks containing religious or mythological symbols or conveying religious or mythological ideas. Examples range from historical pieces featuring gods and goddesses to contemporary works in which the artist engages with broad religious ideas or creates personal mythologies.
4f27162473098200010002ab,africa,http://artsy.net/gene/africa,Africa,Broad Geographic Region,Artists who are from or who have lived in Africa.
4e60345be890b1000124efe0,latin-america-and-the-caribbean,http://artsy.net/gene/latin-america-and-the-caribbean,Latin America and the Caribbean,Broad Geographic Region,Artists who are from or who have lived in Latin America or the Caribbean.
4e60387ce890b10001268166,middle-east,http://artsy.net/gene/middle-east,Middle East,Broad Geographic Region,"Artists who are from or have lived in the Middle East, which includes Bahrain, Egypt, Iran, Iraq, Israel, Jordan, Kuwait, Lebanon, Oman, Palestinian territories, Qatar, Saudi Arabia, Syria, United Arab Emirates and Yemen. "
4e6032e6e890b10001225722,western-europe,http://artsy.net/gene/western-europe,Western Europe,Broad Geographic Region,"Artists who are from or who have lived in the geographic region of Western Europe, which includes Andorra, Austria, Belgium, Denmark, Finland, France, Germany, Greece, Iceland, Ireland, Italy, Liechtenstein, Luxemborg, Monaco, Netherlands, Norway, Portugal, Spain, Sweden, Switzerland, and the United Kingdom."
51f83461275b249051000294,arts-of-africa-oceania-and-the-americas,http://artsy.net/gene/arts-of-africa-oceania-and-the-americas,"Arts of Africa, Oceania, and the Americas",Broad Geographical Style/Movement,"A standard museological category for traditional art and architectural works made by indigenous artists from the geographic regions of Africa, the pre-Columbian Americas, Australia, and the islands of the South Pacific. The term and the treatment of objects described as such have a controversial history, as many non-Western art objects have been treated as archeological, rather than art historical, artifacts, appearing in natural history museums to this day. Efforts to include this artwork in international exhibitions began in the 1980s with such exhibitions as 1984’s “Primitivism,” at the Museum of Modern Art, New York, in which traditional African objects were placed alongside the 20th-century European works they influenced, including those by [Pablo Picasso](/artist/pablo-picasso) and [Max Ernst](/artist/max-ernst). The 1989 exhibition “Magiciens de la Terre,” at Centre Pompidou, Paris, sought to remedy the Eurocentrism surrounding modern art through a balanced presentation of artists spanning all continents but received criticism for its treatment of African and Oceanic artists. Today artists rarely identify with these blanket categories, instead opting for more accurate and specific terms like Native American, Alaska Native and First Nations, Micronesian, Polynesian, or any of the 54 countries and nationalities or hundreds of ethnic groups in the continent of Africa.
"
51f7df77275b246a330002fc,greek-and-roman-art-and-architecture,http://artsy.net/gene/greek-and-roman-art-and-architecture,Greek and Roman Art and Architecture,Broad Geographical Style/Movement,"The art and architecture of ancient Greece and Rome played a foundational role of the history of Western art, establishing numerous key concepts, techniques, and styles that artists in the subsequent millennia have revisited and responded to in countless ways. These include precise techniques for carving and casting free-standing sculptures and the undertaking of large-scale urban building projects, which stemmed from access to and the skilled use of materials ranging from marble to bronze to concrete. “Man is the measure of all things” was a central maxim in Greek culture, and as such, Greek artists scrutinized human forms closely to create idealized Classical figures. They also presented detailed depictions of mythological narratives, which often accentuated the human traits of the pantheon of gods. Roman artists borrowed heavily from these narratives, while contributing many of their own. These developments in art were accompanied by new forms of political life, most notably the form of democracy that emerged in Athens and reached its height during the 5th century BC (the Parthenon was built 447-432 BC). Athens and its neighbors in the eastern Mediterranean participated in a seafaring culture that resulted in a great amount of cultural and economic exchange. Under the Roman Empire (27 BC-395 AD), territories stretching from the present-day Middle East to Scotland were brought under centralized rule. Beginning in the 4th century, cultural and political power shifted to the east of the empire, with Constantinople becoming the capital in 330 and much of the western territory falling into the hands of northern European conquerors thereafter. Around this time, Christianity began to supplant pagan religion—at first persecuted by the state but in the 4th century becoming the official religion under Constantine, which led to the growth of a new body of iconography that would flourish in [Byzantine Art](/gene/byzantine-art)."
4d9396db17cb13253700048a,renaissance,http://artsy.net/gene/renaissance,Renaissance,Broad Geographical Style/Movement,"European art created between the 14th and 16th centuries that drew inspiration from ancient Greek and Roman cultures. The term refers to the renewed effort of artists to achieve exact representations of nature and idealized forms of the human body, which radically departed from the appearance of art and architecture of the preceding Middle Ages. While the [Early Renaissance](/gene/early-renaissance) period in Italy drew from Byzantine aesthetics, the [High Renaissance](/gene/high-renaissance) returned to forms from classical antiquity. This shift was due in part to the development of oil paint in Netherlandish regions and the growing trade of information throughout Europe. In addition to new painting techniques, artists turned toward other areas of study, such as the sciences (which, as a result, also experienced a renewed enthusiasm) and scientific ideas regarding perspective.
"
53d031a8726169448dc30000,downloadable-images,http://artsy.net/gene/downloadable-images,Downloadable Images,Broad Medium,"These images are downloadable for free and may be used independently for teaching, study, and other purposes. Please see [here](https://artsy.net/post/christine-downloading-images-on-artsy) for more detailed information about Artsy's downloadable images."
52780b35275b24061c000342,french-design,http://artsy.net/gene/french-design,French Design,Broad Medium,
5278120b275b2439e3000393,glass-and-ceramics,http://artsy.net/gene/glass-and-ceramics,Glass & Ceramics,Broad Medium,
509854bad7d0430002000025,intaglio,http://artsy.net/gene/intaglio,Intaglio,Broad Medium,"Most likely developed from the decoration of precious metals in medieval times (and with its named derived from the Italian  intagliare, or “to cut into”), intaglio printmaking refers to all printmaking in which an acid or pointed tool is used to incise a metal matrix generally composed of copper, iron, steel, or zinc. The plate is then inked and printed under pressure, forcing the paper into the recessed areas and picking up the ink resulting in characteristically raised lines. Intaglio techniques include [etching, engraving](/gene/etching-slash-engraving), aquatint, photogravure, mezzotint, and drypoint; oftentimes used  in combination, these techniques can produce variations in both tone and contrast, as seen in this [intaglio print](/artwork/francisco-de-goya-figures-dancing-in-a-circle-from-los-disparates) by Francisco Goya.
"
4d90d193dcdd5f44a500007e,portrait,http://artsy.net/gene/portrait,Portrait,Broad Medium,"_""I would wish my portraits to be of the people, not like them. Not having a look of the sitter, being them.” —[Lucian Freud](/artist/lucian-freud)_

Though portraits are generally defined as representations of real individuals intended to capture a likeness, as Freud aptly expresses in the quote above, there is more to a portrait than an exact replication of the subject’s facial features. One of the oldest traditions in art, portraiture has served a variety of purposes, from recording appearances and acting as commemorative gifts, to asserting power. Early portraits preserved likenesses of men after their death, as in Egyptian sarcophagi, death masks, and other [funerary objects](gene/funerary-object). In the [Greek](gene/greek-art) and [Roman](gene/roman-art) periods, statues and coins featured faithful depictions of rulers and distinguished individuals—a convention that was revived during the [Renaissance](gene/renaissance) and after by artists like [Hans Holbein the Younger](artist/hans-holbein-the-younger), [Rembrandt van Rijn](artist/rembrandt-van-rijn) and [Jean-Auguste-Dominique Ingres](artist/jean-auguste-dominique-ingres). These artists emphasized the subject’s pose, dress, and setting to convey a sense of individual identity or even inner psychology. More than any work, [Leonardo da Vinci](artist/leonard-da-vinci)’s Mona Lisa proved that beyond physical likeness, it is often the portraits' intangible essence—possibly the sitter’s thoughts or the stories around the work—that captivates viewers for hundreds of years after their creation."
5058f057d0c2eb4f3200030d,prints,http://artsy.net/gene/prints,Prints,Broad Medium,"A general category for works, typically on paper, that consist of an impressed or stamped image. Printmaking incorporates a large number of techniques and processes, such as [etching, engraving](/gene/etching-slash-engraving), [intaglio](/gene/intaglio), [woodcut](/gene/woodcut-slash-linocut), and more recently, various photomechanical processes. The art form has a long and rich history in numerous artistic traditions. Woodblock printing is believed to have been invented in China in the seventh century and to have spread to Korea and Japan in the following centuries. In the West, devotional woodcut prints appeared beginning in the early 15th century in northern Europe. Since then, prints have been used to numerous ends, from Antonio Pollaioulo’s exploration of the nude form in motion to [Henri de Toulouse-Lautrec](/artist/henri-de-toulouse-lautrec)’s Parisian nightlife posters and [Francisco de Goya](/artist/francisco-de-goya)’s ""Caprichos"", which indicted the follies of European society. Contemporary artists like [Wade Guyton](/artist/wade-guyton) continue to experiment with new forms of printmaking.
"
51aca202700006a03a000027,seating,http://artsy.net/gene/seating,Seating,Broad Medium,"A category for things that are created to be sat on. Among the types of seating are [chairs](/gene/chair), [armchairs](/gene/armchair), folding chairs, recliners, seats, saddles, [stools](/gene/stool), wheelchairs, swings, couches, [sofas](/gene/sofa), settees, loveseats, and [benches](/gene/bench). Throughout human history, an almost infinite variety of approaches have been taken to design and fashion the appearance of seating. While complexly designed chairs date to as early as ancient Egyptian and Greek cultures, formal seating (for example, a chair as opposed to a bench or stool) was rarely used by ordinary people in Western Europe until the 16th century. Importantly, not all cultures prioritize chairs or any type of constructed seating. For example, prior to the 20th century, Japan had a long history of sitting on the floor."
4de57c1b2613fc000100a966,traditional-scroll-painting,http://artsy.net/gene/traditional-scroll-painting,Traditional Scroll Painting,Broad Medium,"Chinese, Korean, or Japanese paintings, often depicting landscapes or scenes from daily life or literary or historic narratives and generally created using an ink brush on scrolled paper, although the methods, styles, and materials varied widely according to region."
505643a07f3276000200030e,19th-century-american-art,http://artsy.net/gene/19th-century-american-art,19th Century American Art,Broad Subject Area,"A general category for artworks made in the United States between 1800 and 1900. While until 1820 American art was largely derivative of European styles, [Thomas Cole](/artist/thomas-cole) and the [Hudson River School](/gene/hudson-river-school) would develop a distinctive style of painting that highlighted the American landscape, a subject that was later explored and imbued with nationalist themes by [Albert Bierstadt](/artist/albert-bierstadt) during his travels through the American West. The realism of [Thomas Eakins](/artist/thomas-eakins) and [Winslow Homer](/artist/winslow-homer) sought to convey democratic values with subtly heroic images of American life; [Albert Pinkham Ryder](/artist/albert-pinkham-ryder) and [Henry Ossawa Tanner](/artist/henry-ossawa-tanner), on the other hand, were less nationalistic, often imbuing Biblical subject matter with a mystical quality in their Symbolist style. [Mary Cassatt](/artist/mary-cassatt) and [John Singer Sargent](/artist/john-singer-sargent), both known for their intimate late-19th-century portraits, painted society subjects on both sides of the Atlantic. During the same time, [Timothy O’Sullivan](/artist/timothy-h-osullivan) developed unique styles of documentary and landscape photography, while socially motivated [Jacob Riis](/artist/jacob-august-riis) trained his lens on New York City tenement life. In architecture, the revivalist styles of [Neoclassicism](/gene/neoclassicism) and Neo-Gothic were used in the construction of monuments in the early half of the century, while the latter saw the development of industrial techniques for building skyscrapers, most notably from the Chicago School.
"
5074a1e2e6df1f0002001ac2,19th-century-american-paintings-and-works-on-paper,http://artsy.net/gene/19th-century-american-paintings-and-works-on-paper,19th Century American Paintings and Works on Paper,Broad Subject Area,"The evolution of styles in 19th-century American art captured the development of the country itself—from young, rural republic to international superpower. Influenced by the [Romantics](/gene/romanticism), [Thomas Cole](/artist/thomas-cole) and the [Hudson River School](/gene/hudson-river-school) (the first homegrown American movement) celebrated nature and expanse in dramatic fashion in the early-mid century, their canvases an expression of American pride. Watercolor also gained new currency among serious painters, becoming a technique that would thrive in the last quarter of the century. By the 1860s and after the devastating Civil War, painters like [Winslow Homer](/artist/winslow-homer) and [Thomas Eakins](/artist/thomas-eakins) emphasized the dark and austere realism of everyday scenes in their work, responding also to the dominant style of European academies. This tradition of emulation continued in the 1870s and '80s with the [American Impressionists](/gene/american-impressionism), working outdoors to render hazy landscapes with broad brushwork. Likewise, [Tonalism](/gene/tonalism)—a progressive movement of transcendentalists—treated nature expressively, even mysteriously, with a spiritual underpinning. At the close of the century, artists brilliantly showcased the wealth and opulence of turn-of-the-century Gilded Age society, though they never entirely strayed from classically American outdoor scenes. From the richly textured portraits of [John Singer Sargent](/artist/john-singer-sargent) and stylized subjects of [James Abbott McNeill Whistler](/artist/james-abbott-mcneill-whistler), to Homer’s windswept landscapes, American art showcased both sophistication and the vast and fruitful American landscape.
"
