artsy_id,artsy_slug,artsy_url,name,type,definition
4de7caaa5a225f0001006fb9,art-brut,http://artsy.net/gene/art-brut,Art Brut,Style or Movement,"A French term meaning “raw art” or “rough art” that was coined by artist [Jean Dubuffet](/artist/jean-dubuffet) to denote works more popularly known as [Outsider Art](/gene/outsider-art), which he championed as exemplifying powerful originality, not stifled by education or socialization. Dubuffet began collecting, writing about, and lecturing on Art Brut in the mid 1940s after visiting Switzerland and seeing works by psychiatric patients collected in hospitals there."
4d90d18fdcdd5f44a500002c,art-deco,http://artsy.net/gene/art-deco,Art Deco,Style or Movement,"Used since the 1960s to refer to a highly decorative style of design, characterized by streamlined geometric forms and bright colors, that was influential in Europe and the United States in the 1920s and 1930s. With roots in [Art Nouveau](/gene/art-nouveau), it was originally promoted by the 1925 Paris Exposition Internationale des Arts Décoratifs et Industriels Modernes, but one could also argue that it emerged from such 20th-century avant-garde movements as [Cubism](/gene/cubism), [Fauvism](/gene/fauvism), and [Constructivism](/gene/constructivism)."
4d90d18fdcdd5f44a500002d,art-informel,http://artsy.net/gene/art-informel,Art Informel,Style or Movement,"Coined by the French critic Michel Tapié in 1950 to refer to an influential European movement that during the 1950s paralleled [Abstract Expressionism](/gene/abstract-expressionism) in the U.S. Like its American counterpart, Art Informel is basically  expressive, artist-oriented abstraction rooted in the works of Vassily Kandsinky, [Paul Klee](/artist/paul-klee), [Jean Dubuffet](/artist/jean-dubuffet), and Surrealist automatism. Note: This category also contains Tachiste works."
4d90d18fdcdd5f44a500002e,art-nouveau,http://artsy.net/gene/art-nouveau,Art Nouveau,Style or Movement,"An international movement that originated in the mid 1890s in Belgium and France and was known in other countries by other names, such as Jugendstil (Germany and Austria), Modernisme (Catalonia), and Tiffany style (United States). Practitioners sought to break with the past, creating a style of ornamentation applicable to architecture, interior design, and objects that was not based on Classical or Renaissance forms. Instead Japanese art was a particular influence, as were exotic flowers and plants. 
"
4d90d18fdcdd5f44a500002f,arte-povera,http://artsy.net/gene/arte-povera,Arte Povera,Style or Movement,"An Italian variant of Conceptualism during the late 1960s and early 1970s that was linked to the political radicalism of the period, which reached its zenith with the student uprisings of 1968. It was marked by an attempt to rescue individuals from the stifling effects of consumer culture and, according to Arte Povera pioneer Germano Celant, the group’s critical mouthpiece, the attempt to break down the separation between art and life. Arte Povera works were either happenings or sculptures that were created with unglamorous everyday materials and often displayed surprising juxtapositions. "
4d90d18fdcdd5f44a5000030,arts-and-crafts-movement,http://artsy.net/gene/arts-and-crafts-movement,Arts and Crafts Movement,Style or Movement,"A movement that emerged during the late 19th century in reaction to the Industrial Revolution in England, at the time the most industrialized nation in the world. It focused on craftsmanship and forms of art and design belonging to the age before mass production. Although the movement did not promote a specific style, many Arts & Crafts works emphasize ties to medieval architecture and nature and stress formal simplicity."
4d90d190dcdd5f44a5000031,ashcan-school,http://artsy.net/gene/ashcan-school,Ashcan School,Style or Movement,"First applied in the 1930s to early 20th-century American urban realist painters such as the Eight, whose members included George Luks, [Robert Henri](/artist/robert-henri), John Sloan, and William Glackens. Ashcan artists presented ordinary aspects of city life with a particular vitality in opposition to the late 19th-century aesthetic, which stressed refined painting techniques, appropriate subject matter, and art for art’s sake. Generally considered revolutionary in the United States, the movement had clear precedents in the French 19th-century avant-garde."
4d90d190dcdd5f44a5000033,barbizon-school,http://artsy.net/gene/barbizon-school,Barbizon School,Style or Movement,"A group of French landscape artists active in the 1830s to the 1870s who eschewed the classical conventions of Claude Lorraine and Nicolas Poussin and instead emulated 17th-century Dutch landscape painters and John Constable. Although often considered a transitional movement between classical 18th-century landscape painting and Impressionism, this group is important in its own right as the first to focus strictly on nature. Barbizon paintings are also antiheroic, unpretentious, and painted in a simplified manner."
4d90d194dcdd5f44a50000ad,baroque,http://artsy.net/gene/baroque,Baroque,Style or Movement,"The major European artistic style of the 17th- into 18th centuries. Though the term is now outdated because of its extreme variance of styles, historically it refers to a style that departs from strict representation of forms to embrace the more fantastic, bizarre, excessive, and elaborate, especially in terms of architecture."
4d90d190dcdd5f44a5000034,bauhaus,http://artsy.net/gene/bauhaus,Bauhaus,Style or Movement,"A school of art, architecture, and design founded in Germany by Walter Gropius and based between 1919 and 1925 in Weimar, between 1925 and 1932 in Dessau, and between 1932 and 1933 in Berlin, where it was shut down by the Nazis. Named after the medieval Bauhütten, or masons’ lodges, and inspired by the ideas of John Ruskin and William Morris, the Bauhaus is best known for reintroducing workshop training in lieu of traditional studio art education; unifying artistic creativity and manufacturing; emphasizing functionalism in architecture; and revolutionizing streamlined industrial design. After the closure of the Bauhaus, many former students and teachers fled the Nazi dictatorship, spreading the tenets of the school to many parts of the world. [Josef Albers](/artist/josef-albers), for example, helped to mold the fledgling graphic design program at Yale while [Laszlo-Moholy Nagy](/artist/laszlo-moholy-nagy) founded the Institute of Design at IIT in Chicago, often dubbed the “New Bauhaus,” where a generation of prominent American photographers—from [Aaron Siskind](/artist/aaron-siskind) to [Harry Callahan](/artist/harry-callahan)—imparted new vigor to experiments in modernist photography. The so-called “Ulm Bauhaus” (Ulm School of Design, Germany) operated from 1953-1968 under the direction of former Bauhaus student [Max Bill](/artist/max-bill), and its innovative curriculum in design education remains influential even today."
4f38d387848eb2150f163abd,bay-area-figurative-art,http://artsy.net/gene/bay-area-figurative-art,Bay Area Figurative Art,Style or Movement,"A movement of mid-20th-century American artists based in San Francisco who abandoned the dominant [Abstract Expressionist](/gene/abstract-expressionism) style of the period and returned to figuration. The four artists initially associated with the term were [David Park](/artist/david-park), [Elmer Bischoff](/artist/elmer-bischoff), [Richard Diebenkorn](/artist/richard-diebenkorn), and James Weeks, who shifted away from the influences of the area’s prominent abstract painters (like Clyfford Still) around 1950. Later on, painters like [Nathan Oliveira](/artist/nathan-oliveira) and [Joan Brown](/artist/joan-brown), and a single sculptor, [Manuel Neri](/artist/manuel-neri), joined the movement. These artists rendered genre scenes, local landscapes, and figure paintings with a luminous palette. In the 1960s, their works became increasingly idiosyncratic, to the extent that they bled into the [Funk Art](/gene/funk-art) movement of the San Francisco underground. Aided by Diebenkorn’s return to abstraction in the late 1960s, the movement fell into decline, though artists like [Elmer Bischoff](/artist/elmer-bischoff), maintained their styles into the 1970s. Seminal to the development of Bay Area Figurative Art were the area’s art schools and institutions such as the Oakland Museum, which mounted an exhibition of these artists in 1957.
"
5266f96a8b3b81ab780002e1,beijing-east-village,http://artsy.net/gene/beijing-east-village,Beijing East Village,Style or Movement,"In the early 1990s, a group of avant-garde artists formed a collective in a dilapidated village on the outskirts of Beijing, dubbing it the East Village after the New York City neighborhood. There, distanced from the rest of the Beijing art world, artists such as [Zhang Huan](/artist/zhang-huan), Li Guomin, and Ma Liuming experimented with stomach-turning feats of [performance art](/gene/performance-art). Zhang famously sat for hours, motionless and covered in honey, in a squalid, fly-infested outhouse for his work _12 Square Meters_ (1994). Beijing East Village artists collaborated on performances that probed the relationship between the human body, the natural landscape, and the urban environment. The photographer [Rong Rong](/artist/rong-rong) documented many of these works and the artists’ daily lives, and it is largely through his images that the group's ephemeral creations are known. Though the Beijing East Village officially ended with a police raid and a forced eviction in 1994, their legacy continues to resonate with many Chinese contemporary artists."
513f820517df3f7880000291,bengal-school-of-art,http://artsy.net/gene/bengal-school-of-art,Bengal School of Art,Style or Movement,
512cf5bc11a414d5960000c9,black-arts-movement,http://artsy.net/gene/black-arts-movement,Black Arts Movement,Style or Movement,"The Black Arts Movement (mid-1960s to mid-1970s) was led by African American cultural practitioners as the “aesthetic and spiritual sister” of the Black Power movement. Its activist principles encouraged the foundation of black-run publishing houses, theaters, and spaces of artistic production and exhibition. Advanced in 1968 as envisioning an art that “speaks directly to the needs and aspirations of Black America” by poet Amiri Baraka (LeRoi Jones) and writer Larry Neal, the Black Arts Movement urged the reinforcement of such mantras as “Black is beautiful” and James Brown’s “Say It Loud, I’m Black and I’m Proud” in the form of a recognizable iconography. For example, Jae Jarrell created [_Urban Wall Suit_](/artwork/jae-jarrell-urban-wall-suit) (1969), a multicolored suit crafted to appear as a graffiti-covered brick wall and a walking sign of the public voice. Iconic images of activists such as [Bob Marley](/tag/bob-marley), Angela Davis, and [Malcolm X](/tag/malcolm-x) pervaded art and popular culture at this time, as did other symbols like the raised fist, Afro hairstyle, and vivid graphic patterns inspired by art and textiles of the [African Diaspora](/gene/african-diaspora). Visual artists often used techniques such as [appropriation](/gene/appropriation), [photo-screen printing](/gene/silkscreen), and [collage](/gene/collage), which lent themselves easily to reproduction and dissemination."
50c73f471738c723c6000d76,black-mountain-college,http://artsy.net/gene/black-mountain-college,Black Mountain College,Style or Movement,"Black Mountain College was a progressive and experimental liberal arts school founded in 1933 in Black Mountain, North Carolina. Though it did not adhere to a specific ideology nor encourage a cohesive artistic style, at the core of the school was a belief in the total integration of art and life, learning through experience and experimentation, democratic self rule among students and faculty, and interdisciplinary collaboration. While faculty members [Robert Motherwell](/artist/robert-motherwell), [Willem de Kooning](/artist/willem-de-kooning), and [Franz Kline](/artist/franz-kline) made the college a center for [Abstract Expressionist](/gene/abstract-expressionism) painting during the ’40s and early ’50s, the school was the site of many watershed moments for individual artist’s careers. It was at Black Mountain that the sound artist and composer [John Cage](/artist/john-cage) composed his seminal work _4:33_; [Robert Rauschenberg](/artist/robert-rauschenberg) painted his monochromatic “White Paintings”; choreographer Merce Cunningham founded his dance company; and Buckminster Fuller designed the geodesic dome. As such, the school remains one of the most significant 20th-century experiments in arts education, art practice, and design."
4d90d190dcdd5f44a5000037,body-art,http://artsy.net/gene/body-art,Body Art,Style or Movement,"The use of the human body as the basis for performance art by such practitioners as [Vito Acconci](/artist/vito-acconci), [Marina Abramovic](/artist/marina-abramovic), [Chris Burden](/artist/chris-burden), and the Vienna Actionists. Characterized by transgression, violence, and endurance, the practice began in the 1960s and 1970s, with connections to [Marcel Duchamp](/artist/marcel-duchamp)’s performative works, [Jackson Pollock](/artist/jackson-pollock)’s painting process, and Allan Kaprow’s 1960s [Happenings](/gene/happenings)."
5045159092999e0002000066,brutalism,http://artsy.net/gene/brutalism,Brutalism,Style or Movement,"Brutalism, an architectural aesthetic based on the idea of ""honest"" construction, was practiced from the 1950s to the 1970s. Brutalist buildings are recognizable for their rough appearance, linear, fortresslike, and blocky construction, as well as their use of common, industrial materials such as steel, glass, brick, and, most characteristically, raw concrete. Additionally, many Brutalist structures' functional components (such as water tanks, electrical towers, and support pillars) are left exposed on the outside of the building. As an architectural philosophy, Brutalism was often associated with utopian socialist ideology. Completed in 1952, Le Corbusier’s Cité radieuse—a public housing complex in Marseille that was built under the premise that each resident should have the same amount of space and equal access to sunlight—is often cited as the initial inspiration for the Brutalist style. Criticism of the style centers around its cold appearance. Brutalist buildings are often also associated with urban decay since they were often built by governments with little money, subject to poor maintenance, and the raw concrete weathered poorly and was subject to vandalism.
"
4d90d195dcdd5f44a50000b3,byzantine-art,http://artsy.net/gene/byzantine-art,Byzantine Art,Style or Movement,
530f580fa09a674af30000cb,calarts,http://artsy.net/gene/calarts,CalArts,Style or Movement,"Artists who attended the California Institute of the Arts, in Valencia, California. Since its founding in 1961, CalArts has become one of the most influential art schools in the United States. Since the early 1970s, CalArts’ School of Art has educated more than 15,000 alumni around the globe and has produced an exceptional number of internationally renowned artists, including [John Baldessari](/artist/john-baldessari), [Ross Bleckner](/artist/ross-bleckner), [Mark Bradford](/artist/mark-bradford), [Eric Fischl](/artist/eric-fischl), [Elad Lassry](/artist/elad-lassry), [Catherine Opie](/artist/catherine-opie), and [David Salle](/artist/david-salle). "
4dee3a151695f00001002c25,capitalist-realism,http://artsy.net/gene/capitalist-realism,Capitalist Realism,Style or Movement,"_“Capitalist Realism was another form of provocation. This term somehow attacked both sides: It made Socialist Realism look ridiculous, and did the same to the possibility of Capitalist Realism as well.” —[Gerhard Richter](/artist/gerhard-richter)_

Capitalist Realism was launched in 1963 in Germany by the artists [Gerhard Richter](/artist/gerhard-richter), [Sigmar Polke](/artist/sigmar-polke), and Konrad Lueg (later to become the dealer Konrad Fischer) not as a movement, but rather as a send-up. Its most iconic expression was a performance titled “Living with Pop – A Demonstration for Capitalist Realism,” orchestrated by Richter and Lueg in the Berges department store in Dusseldorf that same year. The artists invited patrons to come view “what is hailed in America as the greatest breakthrough in art since Cubism,” as an advertisement for the event proclaimed. Puzzled visitors arrived to find the artists making themselves at home in a staged and decidedly average living room (Richter was reading a mystery novel). Of course Capitalist Realism had no such reputation in the U.S.; the artists were parodying the overnight ascendance of [Pop Art](/gene/pop-art), with its celebrity culture and embrace of everyday commodities, as well as the German craze for all things American. Against the backdrop of the Cold War and a divided Germany, the fake movement’s title also alluded to the Soviet doctrine of [Socialist Realism](/gene/socialist-realism). The concerns of so-called Capitalist Realism—heavy-handed irony, investigation of the political aspects of consumerism, and critique of popular culture—have been seen by some as predecessors to a German strain of Pop Art, though the existence thereof is, itself, debatable."
4fa84174e9038a0001000987,chicago-imagists,http://artsy.net/gene/chicago-imagists,Chicago Imagists,Style or Movement,"A term describing a number of groups emerging from the School of the Art Institute of Chicago (SAIC) during the post-World War II era. The Chicago Imagists style is broadly characterized by representational work influenced by [Surrealism](/gene/surrealism) and [Art Brut](/gene/art-brut). Encouraged by SAIC professor Ray Yoshida, many Chicago Imagists also drew on references outside of fine art, such as comics, cartoons, and popular culture. The artists exhibited together in groups like the Monster Roster (late 1950s), Hairy Who (1960s), and, later, Nonplussed Some and False Image. "
532857c6a09a6737bd001067,chicano-art,http://artsy.net/gene/chicano-art,Chicano Art,Style or Movement,"Traditionally defined as artwork created by Americans of Mexican descent, Chicano art is heavily influenced by the Chicano Movement in the United States (also known as El Movimiento, part of the countercultural revolution of the late 1960s and early 1970s). Artists working under this moniker sought to establish a collective identity—one that was affirmative and self-determined and resisted racial stereotypes. Many of these artists also drew inspiration from [Mexican muralism](/gene/mexican-muralism) and [pre-Columbian art](/gene/pre-columbian-art). In 1990, an important traveling exhibition of Chicano artists, “Chicano Art: Resistance and Affirmation,” opened at Wight Gallery at the University of California, Los Angeles. As stated by the exhibition’s advisory committee: “Chicano art is the modern, ongoing expression of the long-term cultural, economic, and political struggle of the Mexicano people within the United States. It is an affirmation of the complex identity and vitality of the Chicano People. Chicano art arises from and is shaped by our experiences in the Americas.” Central to the movement is the concept of “rasquachismo” (from _rasquache_, Spanish for poor), which refers to an attitude of resourcefulness and “making do,” which may refer to using [commonly available materials](/gene/use-of-common-materials), drawing on communities, or even sampling from other art movements or postmodern theories."
4f56d74d5cdd0d00010000be,cluj-school,http://artsy.net/gene/cluj-school,Cluj School,Style or Movement,"A group of painters who coalesced in Cluj-Napoca (the unofficial capital of the historic Transylvania region of Romania) after the 1989 Romanian Revolution. Their style is characterized by the loose application of paint—often with dark, sultry palettes—and the presentation of vignettes illustrating the uncertainty and banality of life after the fall of Communism."
4e7ba52da29c99000104e936,cobra,http://artsy.net/gene/cobra,CoBrA,Style or Movement,"An international artist group active between 1948 and 1951 whose name is derived from the first letters of the capitals of the members’ native countries: Copenhagen, Brussels, and Amsterdam. In the wake of the destruction of World War II, CoBrA rejected Western culture and [Surrealism](/gene/surrealism)&mdash;the most influential prewar art movement&mdash;emphasizing instead experimentation and spontaneous expression and drawing inspiration from children’s drawings and the art of ‘primitive’ cultures."
4d90d190dcdd5f44a500003a,color-field-painting,http://artsy.net/gene/color-field-painting,Color Field Painting,Style or Movement,"A style characterized by large, highly simplified compositions in which the use of color is independent of line and figuration. The term stems from Clement Greenberg’s 1955 description of the paintings being made by [Barnett Newman](/artist/barnett-newman), [Clyfford Still](/artist/clyfford-still), and [Mark Rothko](/artist/mark-rothko) as comprising large fields of color. Historically, color-field painting represents one-half of [Abstract Expressionism](/gene/abstract-expressionism), with the ‘gestural abstraction’ of artists like [Jackson Pollock](/artist/jackson-pollock) and [Willem de Kooning](/artist/willem-de-kooning) representing the other half."
4e29c1360a8fe30001000900,computer-art,http://artsy.net/gene/computer-art,Computer Art,Style or Movement,"Works created using a programmable machine, most often the computer, and so dependent on the capabilities of software and other technologies."
4d90d194dcdd5f44a50000af,conceptual-art,http://artsy.net/gene/conceptual-art,Conceptual Art,Style or Movement,"Works in which the idea, planning, and production process are more important than the result. The term gained currency in the 1960s as a result of [Sol LeWitt](/artist/sol-lewitt)’s 1967 article ""Paragraphs on Conceptual Art"" in _Artforum_. Conceptual art can take many forms, including, most frequently, descriptions and seemingly objective photographic documentation. The use of Conceptualism in contemporary practice is often referred to as [Contemporary Conceptualism](/gene/contemporary-conceptualism)."
50258685db291000020008cd,concrete-art,http://artsy.net/gene/concrete-art,Concrete Art,Style or Movement,"A term coined by Dutch artist and architect [Theo van Doesburg](/artist/theo-van-doesburg) in 1930 to describe abstract art based on mathematic or scientific principles, the visual expression of which was an emphasis on planes and color. Concrete Art has since been associated with other schools of abstraction that spurned expression or gesture, such as the [Bauhaus](/gene/bauhaus) and [Constructivism](/gene/constructivism). Later to be called ""cold abstraction,"" this style was often criticized for its transcendental bent and failure to confront the world. [Lucio Fontana](/artist/lucio-fontana), for example, though associated briefly with the Italian Movimento Arte Concreta (M.A.C.), ultimately found his practice to be at odds with the ""sterile and empty"" formalism of this tendency. A central concept in much of Concrete Art was the idea of “real space,” which was further explored in its Latin American iterations like Arte Concreto-Invención, Arte Madí and the Grupo Neoconcreto. After flourishing for some 20 years, by the 1950s the cerebral concerns of this art—its exploration of pure form and universal principles—were being eclipsed by the more expressive gestural abstraction coming out of the [New York School](/gene/new-york-school) and the [School of Paris](/gene/post-world-war-ii-school-of-paris)."
4d90d190dcdd5f44a500003d,constructivism,http://artsy.net/gene/constructivism,Constructivism,Style or Movement,"A 20th-century movement in painting, sculpture, photography, design, and architecture that began in Russia in the late teens and quickly reached an international audience. Its antecedents were [Cubism](/gene/cubism) and the [Futurism](/gene/futurism) exemplified in Vladimir Tatlin’s 1913 reliefs and three-dimensional geometric constructions. Influenced by Tatlin’s ideas—as well as by the optimism and confidence inspired by the Russian Revolution—such artists as El Lissitzsky and Alexsandr Rodchenko sought to ‘construct’ works that combined geometric compositions with images from modern technology and industry, considering themselves ‘artist-engineers.’ "
4d90d190dcdd5f44a500003e,cubism,http://artsy.net/gene/cubism,Cubism,Style or Movement,"Cubism was the most important movement of the 20th century and marked the birth of abstract art. Invented and pursued by [Pablo Picasso](/artist/pablo-picasso) and [Georges Braque](/artist/georges-braque) in Paris between 1907 and 1914 and inspired by the simplified landscapes of [Paul Cézanne](/artist/paul-cezanne), Cubism took the revolutionary step of rejecting the 500-year-old idea that a painting was like a window, thus ruled by perspective. Instead, Picasso and Braque created more conceptual, subjective paintings that sought to represent the underlying structure of existence. The best-known Cubist works look like shattered glass in dim browns and yellows, and are composed of various sharp planes that combine to form people or objects. Cubism took its name from an insult delivered by the critic Louis Vauxcelles, who commented that one of Braque’s paintings looked as if it were “full of little cubes.” After 1910, Picasso and Braque’s Cubism was quickly adopted by many other artists in Paris and beyond and ended up being the primary influence on most or all abstract art before the outbreak of World War II."
