artsy_id,artsy_slug,artsy_url,name,type,definition
5006ec468f02fc0002000afa,contemporary-vintage-photography,http://artsy.net/gene/contemporary-vintage-photography,Contemporary Vintage Photography,Contemporary Tendencies (Strictly for Artists Prominent in 1990 and After),"_""My plates are horribly flawed, but of course it's the flaws I like.” —[Sally Mann](/artist/sally-mann)_

Against the tide of perfection and eye-popping colors made possible by digital photography, many contemporary photographers have looked to the aesthetics of the past, embracing everything from the soft warmth of a sepia-toned print to the darkroom mishaps and light-spots that used to result from clunky analogue cameras. Artists in this vein employ outdated, labor-intensive techniques, digitally introduce fading, or manually produce the wear-and-tear of vintage photographs—all by way of eschewing the crystal clarity and crisp lighting of much of today's photography."
50356575ab7498000200000d,emerging-art,http://artsy.net/gene/emerging-art,Emerging Art,Contemporary Tendencies (Strictly for Artists Prominent in 1990 and After),"A general category for contemporary artworks created after the year 2000 by contemporary artists under 40 years of age. In addition to younger artists and newer works, the category also includes artists who are relatively under-recognized but for the most part considered on the path to critical and/or market acceptance. While characteristically championed by smaller galleries and art fairs focused on younger artists, larger galleries and institutions regularly focus their energy on so-called emerging artists to define new styles and careers."
53062194b202a3baff000034,mimicking-ruined-materials,http://artsy.net/gene/mimicking-ruined-materials,Mimicking Ruined Materials,Contemporary Tendencies (Strictly for Artists Prominent in 1990 and After),"Works in this category mimic ruins in appearance or bear surface qualities that imitate decayed matter (as opposed to artworks that depict [ruins](/tag/ruins)). Ruins have long been a source of fascination in Western art, where they are often used to convey historical authenticity or to preserve an image of the past. Artificial ruins were among the more popular follies (ornamental buildings or architectural elements) of lavish 16th- and 17th-century European estates; a ruin in the vein of antiquity signified taste, as in [Gian Lorenzo Bernini](/artist/gian-lorenzo-bernini)’s bridge ruin (ca. 1630) at the Palazzo Barberini, in Rome. Examples from contemporary art include [Anselm Kiefer](/artist/anselm-kiefer), who uses charred and deconstructed materials to evoke the dark, mythic qualities of German culture in large-format history paintings. Artist [Daniel Arsham](/artist/daniel-arsham), inspired by his childhood memories of the destruction of Hurricane Andrew in 1991, casts obsolete electronics out of geological materials, while [Sterling Ruby](/artist/sterling-ruby)’s rough-hewn monumental sculptures made of ceramics and bronze resemble exhumed objects. 
"
4de95deac18242000100e131,political-minimalism,http://artsy.net/gene/political-minimalism,Political Minimalism,Contemporary Tendencies (Strictly for Artists Prominent in 1990 and After),"A nonstandard term, contemporary political Minimalism describes contemporary artistic practices that use forms of [Minimalist art](/gene/minimalism) to critically deal with cultural or political subjects. Such approaches are noteworthy because Minimalist artists of the 1960s expressly avoided identifiable political content. Exhibitions such as Klaus Biesenbach’s 2009 _Political/Minimal_ at Berlin’s Kunstwerke have highlighted the explicit political engagement of the work of [Felix Gonzalez-Torres](/artist/felix-gonzalez-torres), [Monica Bonvicini](/artist/monica-bonvicini), and [Alfredo Jaar](/artist/alfredo-jaar), among others. Other examples include [Glenn Ligon](/artist/glenn-ligon), whose Minimalist monochrome paintings include provocative text about race and identity, and [Ai Weiwei](/artist/ai-weiwei), whose [_Tofu_](/artwork/ai-weiwei-tofu) (2012), a white porcelain block, recalls [Sol LeWitt](/artist/sol-lewitt)’s white cubes while drawing attention to the Chinese government’s lack of accountability in urban development (in China, the phrase “tofu-dreg project” refers to shoddy construction). Recent scholarship on Minimalism, however, has argued for its embeddedness in the politics of its day: the use of industrial materials, such as steel and Plexiglas, spoke to American military-industrial prowess, while repeated modular elements conjured a consumer society of replication. Such insights trouble the concept of “pure form” that has long been associated with the movement, creating a fruitful legacy for contemporary artists working in this vein."
55832d157261691532000247,post-internet-art,http://artsy.net/gene/post-internet-art,Post-Internet Art,Contemporary Tendencies (Strictly for Artists Prominent in 1990 and After),"Post-Internet refers to a current trend in art and criticism concerned with the impact of the Internet on art and culture. Taking cues from the understanding of Postmodernism as a reaction to or rejection of Modernism, post-Internet does not imply a time “after” the Internet but rather a time “about” the Internet. While [Net Art](/gene/net-art) of the late 1990s used the Internet primarily as a medium, post-Internet practices use both online and offline formats to engage with [digital culture](/gene/digital-culture), corporate culture, and the effects of ubiquitous networking. Emerging from discussions with Maria Olson in 2008 and elaborated further by critic Gene McHugh in 2009, the term _post-Internet_ continues to evolve, and not all artists often associated with it (for example, [AIDS-3D](/artist/aids-3d-d-keller-and-n-kosmas), [Petra Cortright](/artist/petra-cortright), Lucky PDF, [Jon Rafman](/artist/jon-rafman), [Ryan Trecartin](/artist/ryan-trecartin), [Amalia Ulman](/artist/amalia-ulman), [Harm van den Dorpel](/artist/harm-van-den-dorpel), [Artie Vierkant](/artist/artie-vierkant), and [Addie Wagenknecht](/artist/addie-wagenknecht)) embrace it. Recent exhibitions such as 2014’s _Art Post-Internet_ at the Ullens Center for Contemporary Art, in Beijing, and the New Museum’s 2015 Triennial _[Surround Audience](/show/new-museum-1-2015-triennial-surround-audience)_, in New York, have arguably helped canonize the term."
5266fafdcd530e8bba00025c,related-to-hip-hop,http://artsy.net/gene/related-to-hip-hop,Related to Hip-Hop,Contemporary Tendencies (Strictly for Artists Prominent in 1990 and After),"Artworks or design objects that have some relationship to hip-hop or rap music, which began in the Bronx, in New York City, in 1973. Examples could be depictions of rappers (such as Jay-Z or Slick Rick); [fashion](/gene/related-to-fashion) identified with rap (such as gold chains, ostentatious basketball sneakers, or “pimped” cars); or other aspects of hip-hop culture, such as DJs and breakdancing."
4f5fba5b140dba000100095c,social-action,http://artsy.net/gene/social-action,Social Action,Contemporary Tendencies (Strictly for Artists Prominent in 1990 and After),"Contemporary artworks that take or encourage action around social or political issues, from the global financial crisis to immigration and global warming. Works are often in non-traditional mediums, such as posters, or take the form of participatory events led by collectives rather than single artists. The action can take various forms, from discussions or a general heightened awareness to practical solutions to the issue at hand."
5266ff9d139b2174f10001ce,the-mundane,http://artsy.net/gene/the-mundane,The Mundane,Contemporary Tendencies (Strictly for Artists Prominent in 1990 and After),"Banal, ordinary subject matter, particularly the [representation of objects](/gene/representation-of-everyday-objects) or [places](/gene/vacant-and-vacated-spaces) that are usually ignored or considered to be unremarkable."
4f3eba372ee99a0001000665,advertising-and-brands,http://artsy.net/gene/advertising-and-brands,Advertising and Brands,Content,"Artworks that feature advertisements and logos. [Andy Warhol](/artist/andy-warhol) is most often associated with this practice. His [Pop Art](/gene/pop-art) paintings featuring Campbell’s soup cans and Coca-Cola bottles are icons of contemporary art history. While Pop Art is most often credited with introducing these types of visuals into art history—and moreover, making them the primary feature of an artwork—the practice dates back to [cubist](/gene/cubism) [collage](/gene/collage) in the 1910s. [Pablo Picasso](/artist/pablo-picasso) and [George Braque’s](/artist/georges-braque) papier-collé works commonly included newspaper advertisements. Today, [street artists](/gene/graffiti-slash-street-art) commonly use corporate logos in their work to criticize corporate practices and globalization."
4dc7eb8432e67b0001000127,americana,http://artsy.net/gene/americana,Americana,Content,"Artworks featuring objects or imagery associated with the United States, its history, and its culture, from Westerns and apple pie to World War II and the American flag. More often than not, artists have used Americana less to promote the values of America than as a means for cultural criticism."
4d937b5517cb1325370000ee,animals,http://artsy.net/gene/animals,Animals,Content,"_“Animals are such agreeable friends—they ask no questions, they pass no criticisms.” —George Eliot_

Whether pets, mythological beasts, or wild creatures, animals have always been a major subject of art and literature. Dating back to Paleolithic cave paintings in France and ancient Egyptian reliefs and artifacts, animals have been depicted by artists as friends, allegories, muses, and reflections on human nature."
4d90d193dcdd5f44a5000082,architecture-in-art,http://artsy.net/gene/architecture-in-art,Architecture in Art,Content,"A category that includes images of buildings (in paintings and photographs) as well as models and sculptures of buildings. Some of the earliest known depictions of [architecture](/gene/architecture) are frescoes in an aristocratic house in Boscoreale, Italy, from the 1st century BC that mimic marble columns and other architectural elements. The advent of photography offered countless new possibilities for documenting the built environment, and indeed some photographers have created images of architectural masterpieces as iconic as the buildings themselves."
518ba7fd9c0dedda83000235,atmospheric-landscapes,http://artsy.net/gene/atmospheric-landscapes,Atmospheric Landscapes,Content,"A general category for landscapes with a particularly hazy or soft-focus look. Major examples include paintings by [Tonalists](/gene/tonalism), [Impressionists](/gene/impressionism) (like [Claude Monet](/artist/claude-monet)), and [Romantics](/gene/romanticism) (like [Joseph William Mallord Turner](/artist/joseph-mallord-william-turner)), as well as, more recently, the works of [Wolf Kahn](/artist/wolf-kahn)."
4e84cc5b4f79350001003e1e,bedrooms-and-bathrooms,http://artsy.net/gene/bedrooms-and-bathrooms,Bedrooms and Bathrooms,Content,"Artworks featuring depictions of bedrooms and bathrooms. Common themes of such works include privacy and a lack of inhibition or social constrictions; [nudity](/gene/nude), sex, [the erotic](/gene/erotic), and intimacy; hygiene, cleanliness, and pampering; contemplation; elegance; private habits; [dreams](/gene/dreams-slash-altered-states-of-consciousness) and sleep; [death](/gene/mortality); drug use; [childhood](/gene/childhood); and entertainment (such as TV)."
50f077f59bc2537c1500008a,bible-story,http://artsy.net/gene/bible-story,Bible Story,Content,"Refers to depictions of Old and New Testament narratives, or those from other canonical Jewish or Christian texts. The secluded house church and synagogue excavated at Dura Europos, Syria, contain perhaps the earliest visual representations of Christ and stories from the Bible. After A.D. 313, when Christianity became the official religion of the Roman Empire, biblical iconography became publicly widespread, particularly in mosaics and paintings in churches. These images made important stories immediately recognizable to worshippers in the Middle Ages, and would remain ubiquitous throughout the [Renaissance](/gene/renaissance), with iconic examples painted by [Fra Angelico](/artist/fra-angelico) and [Jan van Eyck](/artist/jan-van-eyck). While the development of secular culture and private patronage in Europe allowed for the proliferation of many other types of images, Bible stories continue to capture the attention of artists; [Francis Bacon](/artist/francis-bacon)’s _Crucifixion Triptych_ and [Doris Salcedo](/artist/doris-salcedo)’s _Shibboleth_ serve as more abstract examples. Importantly, this category includes only representations of stories, and leaves out non-narrative depictions of Jesus or the [Madonna and Child](/gene/madonna-and-child)."
5064837849bc8800020003f4,caricature-slash-parody,http://artsy.net/gene/caricature-slash-parody,Caricature / Parody,Content,"_“The caricaturist plays with the likeness of his victim, and distorts it to express just what he feels about his fellow man.” –E.H. Gombrich_

Caricatures exaggerate features of individuals for the purpose of humor, mockery or criticism. Related to caricature, parody is a narrative or literary device—as opposed to a type of visual depiction—that imitates an original work or set of conventions while distorting it to comic, satirical or critical effect. In Western art, parody can be traced back to ancient Greek drama, while caricature is generally considered to have emerged out of 16th-century carnivalesque culture and grotesque disfigurations of the human figure. Over the course of the late-18th and 19th centuries in Europe and the United States, caricatures circulated in the press and pamphlets often delivered pointed political or social commentary. [William Hogarth](/artist/william-hogarth), considered the father of English caricature, made light of English social mores in his paintings and prints of the late 1700s, and by the 1830s in France a publication devoted entirely to the form, _La Caricature_, provided a forum for [Honoré Daumier](/artist/honore-daumier)’s political drawings. These modes—in particular parody—have been of interest to late-20th-century artists in part because of their prevalence in culture at large, as the popularity of the mockumentary, satirical sketch comedy, lampoons, and spoofs attests."
4e8e1a6dded4a40001008095,circus-slash-carnival,http://artsy.net/gene/circus-slash-carnival,Circus/Carnival,Content,"Images that feature circuses or carnivals. While historically the term “circus” referred to a type of Roman building or a circular road, today it is generally understood to mean a traveling group of performers—often accompanied by animals—who present shows in a large, circular tent. Carnivals are generally understood as traveling amusement shows, with rides like ferris wheels and roller coasters. In the late 19th and early 20th centuries, artists such as [Pablo Picasso](/artist/pablo-picasso) took up the subject of circus performers, building on a long tradition of their representation in art. Circus performers existed on the outskirts of society, and some critics argue that Picasso saw them as comparable figures to avant-garde artists."
4e4ec2464c2606000104bff1,city-scenes,http://artsy.net/gene/city-scenes,City Scenes,Content,"_“All great art is born of the metropolis.” —Ezra Pound_

Different from the urban panoramas of [cityscapes](/gene/cityscape), these works capture glimpses of urban life, from photographs of commuters in subway cars to abstract compositions of architectural elements. Depictions of city life became a popular subject in the late 19th century for Impressionists like [Pierre-Auguste Renoir](/artist/pierre-auguste-renoir) and [Gustave Caillebotte](/artist/gustave-caillebotte), who painted the burgeoning Paris street life that developed with the expansion of Paris’s boulevards and the placement of gas lamps along streets. In the early 1900s the [Ashcan School](/gene/ashcan-school) painters, followed by [Edward Hopper](/artist/edward-hopper), created realist works illustrating American modern life in New York City. Mid 20th-century [street photographers](/gene/street-photography) like [Garry Winogrand](/artist/garry-winogrand) and [Helen Levitt](/artist/helen-levitt) used their medium to document the diverse people, vibrant street signs, moving cars, and crowded crosswalks that give life to a city."
4d90d193dcdd5f44a500007b,cityscape,http://artsy.net/gene/cityscape,Cityscape,Content,"Artworks that depict cities viewed from afar. In Western Art, some of the earliest images of architecture date to ancient Rome, such as those in the Etruscan wall paintings at the Villa Boscoreale (ca. 40 B.C.). Though its exact origins are debatable, the modern practice of depicting cityscapes and skylines is often traced to 15th-century developments in the Netherlands, when small views of towns—seen through windows or dotting the background of sweeping landscapes— often adorned paintings, as in the [Limbourg Brothers](/artist/limbourg-brothers)' _Très Riches Heures du Duc de Berry_. These depictions were further developed in 17th-century Venice in the convention of the _veduta_ (Italian for “view”), which reached its apogee as a popular souvenir purchased by aristocrats on the Grand Tour. While the [Impressionists](/gene/impressionism) captured the hectic and hazy quality of modern life with their views of the boulevards of Europe, the task of truthfully depicting the city in the 19th century fell more and more to photographers"
507479c1cd92460002001828,classical-mythology,http://artsy.net/gene/classical-mythology,Classical Mythology,Content,"Artworks that depict Greek and Roman mythology. Greek mythology, concerned largely with the lives of gods and heroic humans, has origins in oral tradition but was recorded by poets such as Homer, Sophocles, and Euripides. Roman mythology, which borrowed heavily from Greek predecessors, often dealt with myths of origin, social institutions, and human destiny; key poets included Virgil and Ovid and central stories include those of the She-Wolf of the Capitoline and the Rape of the Sabine Women. Mythological narratives were represented widely in Greek and Roman art, particularly in pottery, sculpture, and mosaics. The allegorical power of the widely known stories remained long after the decline of associated pagan religions, and overlaps between pagan and Christian imagery are visible in the tombs of the earliest Christians. While classical imagery was largely dormant in the Medieval period, it returned in full force in iconic Renaissance paintings and sculptures by the likes of [Botticelli](/artist/alessandro-filipepi-called-sandro-botticelli), [Titian](/artist/tiziano-vecellio-called-titian), and [Raphael](/artist/raphael-raffaello-sanzio-da-urbino) in Italy and [Albrecht Dürer](/artist/albrecht-durer) in Germany, all of whom sought to reconcile Christian piety with Classical thought. Subsequent painters who dealt regularly with classical themes included [Peter Paul Rubens](/artist/peter-paul-rubens) and [Nicolas Poussin](/artist/nicolas-poussin), and in 17th- and 18th-century academic painting, the use of classical stories was an esteemed technique. In the last two centuries, artists have treated classical myths with a great deal of flexibility, examples including [Gustave Moreau](/artist/gustave-moreau)'s Symbolist depictions, [Picasso](/artist/pablo-picasso)'s works concerning the Spanish Civil War, and [Romare Bearden](/artist/romare-bearden)'s retelling of classical stories with black subjects.
"
4e5e8792ed9e120001002625,disaster,http://artsy.net/gene/disaster,Disaster,Content,Used in describing artworks that take a disaster as their subject.
50f078255c4d5614ff000081,equestrian,http://artsy.net/gene/equestrian,Equestrian,Content,"Works in the tradition of the equestrian portrait, in which the sitter is depicted on horseback. The mounted figure has been used to convey a sense of authority and monumentality since antiquity, the equestrian statue of Marcus Aurelius in Rome a prime example. Surviving through the Middle Ages, the convention was popularly taken up by artists like [Donatello](/artist/donatello) as part of the [Renaissance](/gene/renaissance) revival of classical forms. The equestrian portrait was a regular court commission during the [Baroque](/gene/baroque) and [Neoclassical](/gene/neoclassicism) periods, as seen in paintings by [Diego Velázquez](/artist/diego-velazquez) and [Jacques-Louis David](/artist/jacques-louis-david). In a similar vein, horses also figure centrally in scenes of war (as in those painted by [Paolo Uccello](/artist/paolo-uccello)), and they have remained a motif in modern and contemporary art, though increasingly portrayed in a manner that critiques or parodies monumentality."
4dcdf34f8080ad0001003a83,erotic,http://artsy.net/gene/erotic,Erotic,Content,"Works that arouse or are related to sexual desire, often incorporating [nude figures](/gene/nude). Although the tradition of erotic art harks back to the ancient Venus of Willendorf, eroticism became a major theme of Western art during the [Renaissance](/gene/renaissance), with the rise of the female nude (as in [Titian](/artist/titian)'s [_Venus of Urbino_](/artwork/titian-venus-of-urbino-1), 1538) as an accepted category of painting. However, eroticism was often covert rather than explicit, until the 20th century, when feminism in particular prompted artists and critics to challenge the taboos of depicting sexuality. Since then, erotic content in art has often been subversive—poking fun at or exposing society's prejudices and assumptions about sexuality."
4d90d196dcdd5f44a50000cb,flora,http://artsy.net/gene/flora,Flora,Content,"Works depicting flowers and plants, whether as the major focus of a painting (as in a still life), part of an elaborate ornamental program (such as on a building or vessel), or as a small, background aspect of a work (as has been the case in thousands of paintings throughout art history). In Western art, flowers have historically been used to symbolize spring, rebirth, hope, and the ephemeral nature of human life. Many flowers have specific meanings tied to them; the rose, for example, has been associated with the Virgin Mary, as well as martyrdom (red roses), purity (white roses), and of course love. Trees, on the other hand, have been used to signify knowledge or its acquisition."
4de7d8bf91b76c000100b370,food,http://artsy.net/gene/food,Food,Content,"_""Tell me what you eat and I will tell you what you are."" —Jean Anthelme Brillat-Savarin_

Food has long been a favored subject of artists, and at times even a medium for making art. In Western Art, depictions of food date back to funerary paintings of food offerings in ancient Egypt. The Classical historian Pliny claimed that Greek painter Zeuxis once painted grapes so realistic that birds came to pick at them. Depictions continued in [Roman art](/gene/roman-art), where the putto (male infant) depicted with grape vines was a common motif. In [Baroque](/gene/baroque) painting, food appeared regularly as a still-life element, as exemplified by [Carravaggio](/artist/michelangelo-merisi-da-caravaggio)'s _Bacchus_ or the _bodegones_ (meaning 'pantry still-lives') of Spanish painters [Diego Velázquez](/artist/diego-velazquez) and [Francisco de Zurbarán](/artist/francisco-de-zurbaran). [Paul Cézanne](/artist/paul-cezanne)'s fruit still lifes presented new forms of representing three-dimensional space. In the 20th century, food was central to [Pop Art](/gene/pop-art)'s explorations of consumerism, as in [Andy Warhol](/artist/andy-warhol)'s Campell's soup cans, [Claes Oldenburg](/artist/claes-oldenburg)'s monumental hamburger and ice cream cone sculptures, and [Wayne Thiebaud](/artist/wayne-thiebaud)'s paintings of cakes and pastries. At its most logical extreme, food has been used as an actual medium for creating artworks, as in [Dieter Roth](/artist/dieter-roth)'s chocolate self-portraits and [Vik Muniz](/artist/vik-muniz)'s reproductions of iconic works of art using materials such as lunch meat and peanut butter."
4f343445848eb2425800a761,group-of-objects,http://artsy.net/gene/group-of-objects,Group of Objects,Content,"Two-dimensional artworks depicting multiple objects whose arrangement does not conform to compositional strategies typical of traditional [still lifes](/gene/still-life).
"
4e0ce7536df5b40001005508,haze,http://artsy.net/gene/haze,Haze,Content,"Works that depict haze or make a significant attempt to capture the atmosphere. Such works are often said to possess an ""atmospheric"" or ""airy"" quality. In Western Art, early examples include the works of [J.M.W. Turner](/artist/joseph-mallord-william-turner) or the [Impressionists](/gene/impressionism).
"
50b9910bca57c575580000c8,hugs-and-kisses,http://artsy.net/gene/hugs-and-kisses,Hugs and Kisses,Content,"Includes artworks that contain an embrace or a kiss between figures. These physical expressions represent affection between people ranging from the platonic to the romantic. In their most intimate iterations in art, hugs and kisses are often seen in bedrooms and bathrooms and among people at home. The cross-cultural motif of the embrace between the mother and her child occurs from [Ancient Egypt](/gene/ancient-egypt) to the Christian tradition of depicting the [Madonna and Child](/gene/madonna-and-child). In other contexts hugs and kisses are among the most highly visible public expressions at parties and celebrations."
