id,slug,gene name,gene family,description,automated?
50649fd87ca2ea00020005da,arabic-slash-farsi-calligraphy,Arabic/Farsi Calligraphy,Medium and Techniques,"While the exact date and location of the origin of Arabic writing is debated, the earliest evidence dates to the 6th century AD. The prophet Muhummad's revelations, which were recorded as the contents of the Qu'ran, occurred in the early part of the 7th century. During the spread of Islam in subsequent centuries, a legible script printed on parchment was essential for transporting and sharing the Qu'ran. In the 9th century, paper became the preferred medium, which led to the development of a more fluid, cursive script in place of the more angular style of the past; paper permitted not only the spread of religious texts, but also the publishing of large numbers of secular books. Farsi calligraphy reached its height around 1400 AD and was regularly used for poetry. While Arabic continued to be the language of sacred texts, Farsi was considered the language of highest literary merit, even as far away as the Ottoman and Mughal empires (present-day Turkey and India, respectively). Images of God were forbidden by the Qu'ran, and figurative art was often suspected of idolatry, so calligraphy is amongst the highest art forms in the Muslim world. Contemporary uses of calligraphy can be found in [Ghada Amer](/artist/ghada-amer)'s sculptures, [Shirin Neshat](/artist/shirin-neshat-2)'s photography, and [Shahzia Sikhander](/artist/shahzia-sikander)'s drawings and paintings.
",FALSE
507c47023dda300002001963,table,Table,Furniture and Lighting,"An item of [furniture](/gene/furniture) that features a flat top and legs, a pillar, or trestles. The earliest known tables existed in [Egypt](/gene/egypt) during the Fourth Dynasty. Until the 20th century, basic table designs were simple, featuring either a circular or rectangular design and legs or a single foot. The use of [metals](/gene/metal), plastics, and glass since the early 1900s has enabled tables to take an almost endless array of forms.",TRUE
507c49492ea57a00020018a8,armchair,Armchair,Furniture and Lighting,"A [chair](/gene/chair) with extensions at its sides to support a person’s arms. At a rectangular [table](/gene/table), an armchair is usually employed alongside [side chairs](/gene/side-chair). Armchairs are positioned at the heads of the table—and are traditionally for the more important or senior members of a group—while armchairs are positioned at the sides.",FALSE
507c499a024bd20002001986,dining-table,Dining Table,Furniture and Lighting,"",FALSE
506617db6988580002000080,yuan-dynasty,Yuan Dynasty,Cultural and Religious Styles,"",TRUE
507c49e3177a7a0002001aed,chaise-lounge,Chaise Lounge,Furniture and Lighting,"Chaise lounges—elongated chairs designed for reclining—go by many names, including _chaise longues_, long chairs, and daybeds. In the Victorian era, the chaise lounge became popular as a “fainting couch” for tightly-corseted women, and symbolized luxury and relaxation in the home. In collaboration with [Charlotte Perriand](/artist/charlotte-perriand) and [Pierre Jeanneret](/artist/pierre-jeanneret), the famed architect [Le Corbusier](/artist/le-corbusier) designed a modern version of the chaise lounge in 1928, which featured a sleek metal frame that could move up or down to meet the user’s preferences. The American duo [Charles and Ray Eames](/artist/charles-and-ray-eames) produced multiple chaise lounges, including the white fiberglass “La Chaise” (1948), the “Billy Wilder” napping couch (1968), and the ever-popular plywood and leather “Lounge Chair and Ottoman” (1956).",TRUE
507c4b2c2ea57a0002001915,bowl,Bowl,"Tableware, Vessels, and Objects","A round dish used for food, liquid, or ornamentation.",TRUE
5064837849bc8800020003f4,caricatures-and-parody,Caricatures and Parody,Subject Matter,"_“The caricaturist plays with the likeness of his victim, and distorts it to express just what he feels about his fellow man.” –E.H. Gombrich_

Caricatures exaggerate features of individuals for the purpose of humor, mockery or criticism. Related to caricature, parody is a narrative or literary device—as opposed to a type of visual depiction—that imitates an original work or set of conventions while distorting it to comic, satirical or critical effect. In Western art, parody can be traced back to ancient Greek drama, while caricature is generally considered to have emerged out of 16th-century carnivalesque culture and grotesque disfigurations of the human figure. Over the course of the late-18th and 19th centuries in Europe and the United States, caricatures circulated in the press and pamphlets often delivered pointed political or social commentary. [William Hogarth](/artist/william-hogarth), considered the father of English caricature, made light of English social mores in his paintings and prints of the late 1700s, and by the 1830s in France a publication devoted entirely to the form, _La Caricature_, provided a forum for [Honoré Daumier](/artist/honore-daumier)’s political drawings. These modes—in particular parody—have been of interest to late-20th-century artists in part because of their prevalence in culture at large, as the popularity of the mockumentary, satirical sketch comedy, lampoons, and spoofs attests.",FALSE
505cc37992a60b0002000a24,art-of-tonga,Art of Tonga,Cultural and Religious Styles,"",TRUE
507c48ff2ea57a00020018a0,furniture,Furniture,Furniture and Lighting,"A general category for functional design objects used in living and working spaces. The history of furniture, which spans virtually all cultures and time periods, reveals a tremendous variety of functions and styles. In France, for example, resplendent 17th-century court furniture by craftsman such as [André-Charles Boulle](/artist/andre-charles-boulle-the-elder-1) gave way to the stark simplicity and functionalism of 20th-century designs by the likes of [Jean Prouvé](/artist/jean-prouve) and [Charlotte Perriand](/artist/charlotte-perriand). While the modern Western home and office are strongly associated with items such as the couch and the desk, traditional Japanese interiors almost entirely lack freestanding furniture. In the 20th century, furniture design was an integral part of the modernist artistic practice of icons such as [Donald Judd](/artist/donald-judd) and [Isamu Noguchi](/artist/isamu-noguchi).",TRUE
507c497581f5960002001a71,side-chair,Side Chair,Furniture and Lighting,"A chair without arms, meant for the side of a [table](/gene/table). Chairs at the head of a table characteristically have arms.",FALSE
507c49bf177a7a0002001ae0,side-table,Side Table,Furniture and Lighting,"",FALSE
507c4b75b5f0450002001b2b,tray,Tray,"Tableware, Vessels, and Objects","Trays—not depictions of them, in [paintings](/gene/painting) or [photographs](/gene/photography), but the physical objects. Trays can be functional, standalone items; exquisitely designed objects; or components of [sculptures](/gene/sculpture).",TRUE
505cc2ef67ad450002000a2a,moche-art,Moche Art,Cultural and Religious Styles,"",TRUE
5075e00586203100020010ed,sui-dynasty,Sui Dynasty,Cultural and Religious Styles,"",TRUE
505fa1601e26740002000072,post-world-war-ii-school-of-paris,Post-World War II School of Paris,Styles and Movements,"_""The number, the diversity of movements and the personalities of the creating artists, not ... a school but rather a salutary anti-school."" —[Pierre Soulages](/artist/pierre-soulages)_

A center of artistic innovation in the early 20th century, Paris welcomed back a cohort of important modern artists after WWII, including [Matisse](/artist/henri-matisse), [Picasso](/artist/pablo-picasso), and [Giacometti](/artist/alberto-giacometti). It also hosted a new generation of international artists, working in a variety of styles and together revitalizing the Paris art scene. Perhaps most closely associated with this loose, geographical community is a style of lyrical abstraction practiced by Soulages and [Nicolas de Staël](/artist/nicolas-de-stael), as well as the newly minted ""[Art Brut](/gene/art-brut)"". In this diverse artistic milieu, the Kineticism of [Victor Vasarely](/artist/victor-vasarely) and [Jean Tinguely](/artist/jean-tinguely) could be seen alongside Los Disidentes (a group of expatriate Latin American artists). A series of exhibitions in the 1950s helped to mythologize the School and cement for the public a list, however informal, of its members.",FALSE
5064a08c49bc880002000537,qing-dynasty,Qing Dynasty,Cultural and Religious Styles,"",TRUE
507478a6c9aa95000200176e,related-to-religion,Related to Religion,Subject Matter,"A general category for artworks that feature religious subject matter or are in some respect connected to religion, but are not immediately understood as works of religious art (i.e. those made for a church or sacred space). Examples come from a wide range of movements and include subject matter from Christian, Islamic, Buddhist, Hindu, and other faiths; these works are often understood as openly criticizing religious subject matter. Recent examples include controversial works like [Andres Serrano](/artist/andres-serrano)'s _Piss Christ_ and [Chris Ofili](/artist/chris-ofili)'s _The Holy Virgin Mary_ (which included elephant dung).",FALSE
5078769ce8db2100020005b5,post-war-european-art,Post-War European Art,Styles and Movements,"A general category for European artists working in the period following World War II (roughly 1945-70). Though necessarily broad, in general this group of artists attempted to re-establish identity and cope with the trauma of the war, the onset of the Cold War, and the shift in the art world center from New York to Paris. The period saw a multitude of movements appear across the continent—including Tachisme, [Art Informel](/gene/art-informel), [Nouveau Réalisme](/gene/nouveau-realisme), [Fluxus](/gene/fluxus), and [Arte Povera](/gene/arte-povera)—both originating in Europe and informed by international developments, particularly in the United States and Japan. Some of the countless major artists to emerge included [Jean Dubuffet](/artist/jean-dubuffet), [Alberto Giacometti](/artist/alberto-giacometti), and [Francis Bacon](/artist/francis-bacon).",TRUE
507c4bb3f18a5a0002001bc4,tapestry-and-wall-hanging,Tapestry and Wall Hanging,Textiles,"A form of [textile arts](/gene/textile-arts), tapestry making involves the often-meticulous process of weaving continuous and discontinuous threads of fabric to produce either pictorial or abstract designs. While the earliest tapestries date to 11th-century Germany, in several European centers the commercial production of tapestries for nobility began in the 14th century and expanded thereafter. Among the most iconic works produced during this period are the seven tapestries of [_The Hunt of the Unicorn_](/artwork/the-unicorn-at-bay-from-the-hunt-of-the-unicorn-tapestries), which are made of wool, silk, and metallic thread and follow a detailed, symbol-laden narrative. With changing tastes and attitudes in Europe, commercial tapestry production substantially decreased in the 19th century. Interest in tapestry was renewed in the late 19th century by the [Arts and Crafts movement](/gene/arts-and-crafts-movement) in England and the Wiener Werkstätte in Germany, which advocated preindustrial craftsmanship. In the 20th century, artist [Anni Albers](/artist/anni-albers) was a proponent of tapestry weaving at the [Bauhaus](/gene/bauhaus) and at [Black Mountain College](/gene/black-mountain-college), while present-day artists such as [Sheila Hicks](/artist/sheila-hicks) continue in this tradition. [Alighiero e Boetti](/artist/alighiero-e-boetti) is known for involving other craftsmen in the production of tapestries, while [El Anatsui](/artist/el-anatsui) incorporates scrap metal and discarded plastic into his intricate tapestry-like wall hangings.",TRUE
507c4d4ab5f0450002001b6b,jewelry,Jewelry,Artistic Disciplines,"A category for objects of personal adornment—such as rings, bracelets, necklaces, earrings, and pendants. Since antiquity, jewelry has often fulfilled a functional as well as decorative role, whether as protective and magical talismans or signifiers of wealth and power. Jewelry was also used to distinguish members of a particular religion or indicate social status, a tradition that persists to this day along with the custom of giving jewels as tokens of love and friendship. The art of jewelry-making includes intricate and delicate metalwork, gem engraving, enamel painting, and all different aspects of design.",TRUE
505ce943b6bf600002000162,art-of-the-congo,Art of the Congo,Cultural and Religious Styles,"",TRUE
5060aafc7b9158000200015d,eastern-zhou-dynasty,Eastern Zhou Dynasty,Cultural and Religious Styles,"",TRUE
5064a04377539e0002000585,ming-dynasty,Ming Dynasty,Cultural and Religious Styles,"",TRUE
506b655dbf313e00020014f7,art-of-the-upper-paleolithic,Art of the Upper Paleolithic,Cultural and Religious Styles,"",TRUE
507c4a66c51f290002001b92,vessel,Vessel,"Tableware, Vessels, and Objects","[Bowls](/gene/bowl), [vases](/gene/vase]), and other hollow containers characteristically used for liquids.",FALSE
507c6812f1a2ab0002000309,poster,Poster,Medium and Techniques,"Large printed pictures—usually a combination of images and words—that advertise events or messages. Posters are usually printed without regard for edition size and installed in public for a mass audience. The first large-scale color posters (printed using color lithography) appeared in the mid-19th century in Paris and became popular in other European countries and in the United States toward the end of the 19th century. Through the late 20th century, developments in [photography](/gene/photography) and [photomontage](/gene/photomontage) made posters one of the most influential forms of propaganda and advertising, as well as an important way in which youth culture identified itself.",FALSE
507c4f9bf18a5a0002001cb3,chrome-plated,Chrome-Plated,Materials,"While this category primarily concerns [design objects](/gene/design), it applies to any works featuring a chromium layer that has been electroplated onto all or part of its [metal](/gene/metal) or [plastic](/gene/plastic) surface(s). Chrome-plating is used to help surfaces resist abrasion and corrosion, as well as to create a highly polished finish. Chrome is most often associated with automobiles, particularly those of the 1950s and [’60s](/gene/1960s).",TRUE
507c50212ea57a0002001a50,wallpaper,Wallpaper,"Tableware, Vessels, and Objects","Decorative paper that is applied in strips to the walls of a room. In Europe, wallpaper became popular in the [17th century](/gene/17th-century). In the [18th century](/gene/18th-century), machines were developed for printing wallpaper, and during the [19th century](/gene/19th-century) it became widely available in varieties that contained as many as 20 colors. While wallpaper was popular during the first third of the [20th century](/gene/20th-century-art), Modernism’s preference for white walls led to its decline.",FALSE
508037a378fe1e0002000581,patinated-and-oxidized,Patinated and Oxidized,Visual Qualities,"Patination and oxidation are chemical reactions that change the surface appearance of metals like bronze or copper, creating a green, pigmented “patina,” or “verdigris.” This chemical change occurs naturally as metal ages, as with [ancient ritual bronzes](https://www.artsy.net/artwork/504604d92c4be800020002a4) from China, but it may also be the deliberate choice of the sculptor. Bronze sculptures from [classical Greece and Rome](https://www.artsy.net/gene/greek-and-roman-art-and-architecture/artworks?for_sale=&include_medium_filter_in_aggregation=true&medium=sculpture), such as the famous [_She-Wolf of the Capitoline_](https://www.artsy.net/artwork/she-wolf-of-the-capitoline), were cherished by [Renaissance](https://www.artsy.net/gene/renaissance/artworks?for_sale=&include_medium_filter_in_aggregation=true&medium=sculpture) artists like [Donatello](https://www.artsy.net/artist/donatello), who mimicked those works’ patina to connote antiquity. Today, contemporary artists like [Igor Mitoraj](https://www.artsy.net/artist/igor-mitoraj) replicate this aesthetic. Other artists have exploited oxidation processes for various formal effects, including [Andy Warhol’s](https://www.artsy.net/artist/andy-warhol) infamous Oxidation paintings—made from the reaction of urine on metallic copper paint—or the rust on [Richard Serra’s](https://www.artsy.net/artist/richard-serra) [_Tilted Arc_ (1981)](https://www.artsy.net/article/artsy-editorial-how-richard-serra-changed-the-course-of-public-art), the result of the public steel sculpture being subjected to the elements.",TRUE
509854e6eb9b19000200000e,etching-slash-engraving,Etching/Engraving,Medium and Techniques,"Most likely derived from the decoration of metal armor in Northern Europe during the 15th century, etching and engraving are the two major intaglio printmaking techniques. Though they produce visually similar results, etching involves incising a wax-coated metal plate with a sharp tool and placing the plate into an acid bath. The acid corrodes the exposed lines, leaving the waxy ground unaffected; the plate is then inked and printed, forcing the paper into the incised lines. Considered one of the great masters of the technique, [Rembrandt van Rijn](/artist/rembrandt-van-rijn) harnessed the medium’s similarity to drawing with a pencil or pen. Engraving, the oldest intaglio technique and the most common method seen in Old Master prints, involves directly incising a metal matrix and then printing. Engraving arguably reached its pinnacle with [Albrecht Dürer](/artist/albrecht-durer), who mastered the technique's precise and tapered lines to achieve great tonality as seen in [this print](artwork/albrecht-durer-st-anthony).",FALSE
50870332a1b4cc000200070c,linear-forms,Linear Forms,Visual Qualities,"A term for artworks that foreground straight lines and discrete shapes as if drawn with a ruler, without indication of the artist’s hand. While lines demonstrating a mathematical precision and edge can be found in figurative works emphasizing linear perspective as well as classical architecture, such forms are generally found in abstract art, design, and architecture. Classic examples include paintings by [Piet Mondrian](/artist/piet-mondrian) or [Josef Albers](/artist/josef-albers), [Donald Judd](/artist/donald-judd)'s [Minimalist](/gene/minimalism) sculptures, or [Bauhaus](/gene/bauhaus) architecture.",FALSE
5081759541b889000200022c,altered-and-substituted-canvases,Altered and Substituted Canvases,Medium and Techniques,"_“While working on one of my perforated canvases, I do not want to make a painting: I want to open up space, create a new dimension for art . . . I have not attempted to decorate a surface but on the contrary I have tried to break its dimensional limitations.” —[Lucio Fontana](/artist/lucio-fontana)_

Since the 1950s, many artists working with canvas have used the medium to probe the fundaments not of paint on a support, but of the support itself. Some have explored the material properties of the support by perforating and slashing it (as did Fontana), twisting and contorting it (like Stephen Parreno), or replacing it entirely with everything from metallic foil to plastic. For Fontana, the alteration of a canvas in his ""Concetto Spaziale"" (spatial concept) series was a way to move beyond the picture plane and activate the space behind and around the work. German artist [Blinky Palermo](/artist/blinky-palermo)’s “Cloth Paintings” (produced between 1966-72) were made by sewing two different colors of cloth together and stretching them over a canvas, which for Palermo expressed the “spiritual presence of color.”",FALSE
50984057b7979c000200142e,cambodian-art,Cambodian Art,Cultural and Religious Styles,"",TRUE
50985816e45e130002000043,transfer,Transfer,Medium and Techniques,"A general label for the technique of transmitting an image from one surface to another. Artists have long incorporated the transfer technique into a variety of artistic practices. During the late 14th century [Renaissance](/gene/renaissance) artists transferred preparatory drawings or designs to moist plaster when making fresco paintings—a method that is also often incorporated into the process of developing a painting or print. In the 1750s, transfer printing was invented to decorate enamels and ceramics. [Robert Rauschenberg](/artist/robert-rauschenberg) used the technique in the 1960s as an art form in and of itself, creating “transfer drawings” from found imagery culled from newspapers and magazines, which he soaked in solvent and rubbed face down onto paper.
",FALSE
508844241c7f9600020001c1,tool,Tool,"Tableware, Vessels, and Objects","Tools—not depictions of them, in [paintings](/gene/painting) or [photographs](/gene/photography), but the physical objects. Tools could be functional, standalone items; exquisitely designed [objects](/gene/design); or components of [sculptures](/gene/sculpture).",FALSE
507c5351024bd20002001c59,postmodern-architecture-and-design,Postmodern Architecture and Design,Design Movements,"Postmodern architecture and design originated in the late 1970’s as a response to Modernism. In architecture and design, Postmodernity is characterized by the return of ornament and symbol to form. [Robert Venturi](/artist/robert-venturi), one of the most prominent Postmodernist architects, wrote two books that were instrumental in defining the movement: _Complexity and Contradiction in Architecture_ (1966) and _Learning from Las Vegas_ (1972). In the former, Venturi argued that Modernism, in its search for “purity” through use of minimal materials and a functionally driven aesthetic, was reductive, calling instead for the return of wit, ornament, and historical reference. Other prominent architects and designers associated with Postmodernism include [Frank Gehry](/artist/frank-gehry), [Ettore Sottsass](/artist/ettore-sottsass), and [Phillip Johnson](/artist/philip-johnson). In their work, the functional and formalized shapes and spaces of the Modernist style are replaced by diverse aesthetics: styles collide, form is adopted for its own sake, and new ways of viewing familiar styles and spaces abound.
",FALSE
507c4f70623c020002001c5b,silver,Silver,Materials,"Artworks or design objects that are wholly or partly made of silver. In recent years, artist [Jacob Kassay](/artist/jacob-kassay) has become well known for his series of “silver paintings,” which he created by electroplating silver over acrylic on canvas.",FALSE
50882ad2da1bda0002001d6b,celtic-art,Celtic Art,Cultural and Religious Styles,"",TRUE
508d444eedee4b0002000db0,aluminum,Aluminum,Materials,"Artworks and design objects created from aluminum. Many of the works in this category are contemporary photographs or prints that are mounted to aluminum, rather than a more traditional frame.",FALSE
509b2d82b59f29000200007c,ceramic,Ceramic,Materials,"_“Earth, water, air and fire so simple, but so complex.” —Unknown_

Ceramics are made by shaping water, earthen powders, and clay into forms, which are then fired at high temperatures. Around the globe, the earliest examples were developed purely out of the need for hand-formed tools and ceremonial objects; some of the earliest surviving ceramics include the [_Venus of Willendorf_](/artwork/venus-of-willendorf) (24,000 B.C.) and the Qin Dynasty’s Terracota Army (210 B.C.). Since, ceramics have evolved into an increasingly complex, versatile art form. Interrogating the boundaries of sculpture, form, and function, ceramics encompass a myriad of techniques and styles, such as Japanese raku, wheel-throwing, slab construction, and hand-forming, as well as various clay types including terracotta, stoneware, and porcelain. Having bridged the art-craft divide, present-day ceramic artists like [Katsuyo Aoki](/artist/katsuyo-aoki), [Shio Kusaka](/artist/shio-kusaka), and [Rachel Kneebone](/artist/rachel-kneebone) are evolving the traditional techniques of ceramics practiced by pioneers like Paul Daschel, Edmond Lacenal, and [Galileo Chini](/artist/galileo-chini) to produce increasingly innovative and experimental contemporary ceramic works.",TRUE
50ac09562bd73983a000045e,enamel,Enamel,Materials,"A glass or vitreous paste that has historically been used to coat and decorate metals and ceramics. The paste is fused to the metal or ceramic—and made incredibly solid—through the application of heat, whether in a kiln or through a smaller heat source like a blowtorch.


",FALSE
5089a1ceb135730002001a38,new-american-documentary-photography,New American Documentary Photography,Styles and Movements,"An informal grouping of 1950s and '60s American photographers who introduced a variety of new perspectives on documentary photography. [Diane Arbus](/artist/diane-arbus), [Garry Winogrand](/artist/garry-winogrand), and [Lee Friedlander](/artist/lee-friedlander) introduced ""snapshot"" angles and concentrated on subcultures, as well as absurd and incendiary subject matter. At the same time, [Stephen Shore](/artist/stephen-shore) and [Robert Adams](/artist/robert-adams) documented the changing American landscape, while [William Eggleston](/artist/william-eggleston) broke ground with his use of color photography.",FALSE
