id,slug,gene name,gene family,description,automated?
4e5707385dca140001003a7f,suspended-slash-hanging,Suspended/Hanging,Medium and Techniques,"The technique of hanging an artwork, typically sculptural, from the ceiling, or suspending a series of objects in space, giving the effect of them floating in air. The development of the technique is linked with a number of different modernist avant-garde practices: [Marcel Duchamp](/artist/marcel-duchamp) hung readymades such as a shovel and hat rack from the ceiling, while [Alexander Calder](/artist/alexander-calder)'s iconic mobiles were delicate ""drawings in space"" susceptible to subtle movements of air. Playing with concepts of visual perception and interactivity, [Jesús Rafael Soto](/artist/jesus-rafael-soto)'s _Penetrables_ consist of thin hanging tubes that permit viewers to enter the space of the sculpture itself. The hanging of objects from above has become common in contemporary installations, especially in works that seek to create an immersive or engineered effect. These range from [Ernesto Neto](/artist/ernesto-saboia-de-albuquerque-neto)'s membrane-like passageways, to [Cai Guo-Qiang](/artist/cai-guo-qiang)'s dramatic installations, to [Maurizio Cattelan](/artist/maurizio-cattelan)'s humorous, provocative sculptures, all of which were hung together in the Solomon R. Guggenheim Museum's rotunda for his retrospective exhibition, ""All.""
",FALSE
4e5e8792ed9e120001002625,disaster,Disaster,Subject Matter,Used in describing artworks that take a disaster as their subject.,FALSE
4e5fe867e890b10001023609,cultural-commentary,Cultural Commentary,Subject Matter,"A broad category for artworks that comment on various aspects of contemporary culture, often quite critically, as in works that focus on the misdeeds of political figures, the imperial actions of governments, or global economic inequalities. The 19th century French artist [Honoré Daumier](/artist/honore-daumier), dubbed the “Michelangelo of caricature,” is most often associated with cultural commentary in art. He satirized France’s bourgeoisie and justice system, and grotesquely caricatured government officials, which endeared him to the public, but also landed him six months in prison.",FALSE
4e5ffb90e890b1000109763d,unsettling-1,Unsettling,Subject Matter,"_""Fantasy, abandoned by reason, produces impossible monsters."" —[Francisco de Goya](/artist/francisco-de-goya)_

Artworks with disquieting or disturbing imagery, whether of monsters or violent misfortunes, the [grotesque](/gene/grotesque) or the [abject](/gene/the-abject). Well known historical examples include the works of Goya, [James Ensor](/artist/james-ensor), and [Edvard Munch](/artist/edvard-munch). In (especially recent) contemporary practice, unsettling imagery continues to fascinate artists, including [YBAs](/gene/young-british-artists-yba) [Damien Hirst](/artist/damien-hirst) and [Jake and Dinos Chapman](/artist/jake-and-dinos-chapman).",FALSE
4e603433e890b1000124d653,india,India,Geographic Regions,Artists who are from or who have lived in India.,TRUE
4e6034a6e890b10001250c98,canada,Canada,Geographic Regions,Artists who are from or who have lived in Canada.,TRUE
4e663d39d726df00010002f9,the-netherlands,The Netherlands,Geographic Regions,Artists who are from or who have lived in The Netherlands.,TRUE
4e7b44922f6f5c0001002033,language,Language,Subject Matter,"Artworks that engage with conceptual issues surrounding language, such as translation, the relationship between words and images, and semiotics. Such works typically include written texts, but some engage language more obliquely; for instance, [Leon Ferrari](/artist/leon-ferrari) often abstracted the formal elements of writing, and artists associated with [Dada](/gene/dada) addressed the arbitrariness of linguistic meaning through the use of nonsense speech. [_The Rosetta Stone_](/artwork/the-rosetta-stone-1) (196 B.C.), inscribed in three languages, is one of the earliest artifacts that demonstrated the need for translation in order to communicate history. The use of language as a primary material emerged as a central feature of [Conceptual Art](/gene/conceptual-art), as embodied in [Joseph Kosuth](/artist/joseph-kosuth)'s works involving images and corresponding dictionary definitions, or [Lawrence Weiner](/artist/lawrence-weiner)'s treatment of language as sculptural matter. The text-based works of [Jenny Holzer](/artist/jenny-holzer) and [Barbara Kruger](/artist/barbara-kruger) present language as a form of power and authority, using it both to startle and to amuse, while [Ed Ruscha](/artist/ed-ruscha), in his paintings, explores the clichéd language of pop culture.
",FALSE
4ebd60601439700001008a16,the-environment,The Environment,Subject Matter,"Although artists have long engaged with concepts of nature in the tradition of [landscape](/gene/landscapes), distinctly environmentalist artwork emerged in the 1960s in parallel with related social movements. Iconic [Land Art](/gene/land-art) projects by [Robert Smithson](/artist/robert-smithson) and [Christo and Jean-Claude](/artist/christo-and-jeanne-claude) were both celebrated for creating new spaces and audiences and critiqued for the damage they often inflicted on their environments. Perhaps in response, artists of succeeding generations have sought to explore the relationship between humans and the environment without damaging the latter. This is illustrated in such works as [Richard Long](/artist/richard-long)'s walks through remote territories and [Andy Goldsworthy](/artist/andy-goldsworthy-2)'s ephemeral sculptures in nature. In 1982, [Joseph Beuys](/artist/joseph-beuys) initiated the planting of 7,000 oak trees throughout Kassel, Germany, as his contribution to “Documenta 7.” Contemporary artworks often use documentation to raise awareness of human-caused environmental degradation, as seen in photography by [Edward Burtynsky](/artist/edward-burtynsky) and [Richard Misrach](/artist/richard-misrach), and in research-driven investigations of the systems governing social and natural ecologies, as in the work of [Mark Dion](/artist/mark-dion). In the era of global climate change, new terminology sheds light on shifting priorities; scientists have proposed the term Anthropocene for the current epoch in which human activity impacts every ecosystem on the planet, and “Eco Art” is gaining currency as a term to describe art that furthers ecological sustainability or takes the form of environmental activism.
",FALSE
4e0ce822569582000100414f,transparent-slash-translucent-medium,Transparent/Translucent Medium,Visual Qualities,"Artworks that viewers can see through, or almost see through. To achieve transparency, contemporary sculptors often use glass, resin, or plastic in their work. Artists who create a translucent effect in two dimensions characteristically employ a light touch, using watered-down pigments or executing their work on clear objects.",FALSE
4e0ce8bde066dd00010038b5,sharp-slash-prickly,Sharp/Prickly,Visual Qualities,Three-dimensional artworks and design objects with distinct points or jagged edges that look like they could cut or tear something. Iconic examples are Man Ray’s [_Cadeau_](/artwork/man-ray-cadeau-1) or Marcel Duchamp’s [_Bottle Rack_ ](/artwork/marcel-duchamp-bottle-rack-the-original-lost-was-carried-out-in-paris-in-1914-the-replica-was-carried-out-under-the-direction-of-marcel-duchamp-in-1964-by-the-gallery-schwarz-milan) readymade.,FALSE
4e4d88deb6944a00010156d6,camera-obscura,Camera Obscura,Medium and Techniques,"An optical device consisting of a darkened chamber with a small circular opening to let a small amount of light pass through. It traces its history back to the essential components of the pinhole camera in both Eastern and Western ancient civilizations. Importantly, the image of the space projected from the hole to the inside surface of the chamber is reversed. The camera obscura faded in popularity with the invention of photography in the mid nineteenth century, however modern and contemporary artists have often sought out the pinhole method for its more purified representation.",FALSE
4e5ff520e890b10001073a72,the-fantastic,The Fantastic,Subject Matter,"A general category for artworks depicting scenes, figures, or objects that appear to be imaginary, illusory, irrational, or bizarre. The earliest artist to explore the fantastic might have been [Hieronymus Bosch](/artist/hieronymus-bosch), who created allegorical paintings—like _The Garden of Earthly Delights_—of mythical creatures and humans in uncanny, imaginary landscapes. Arguably the best known modern movement associated with the fantastic is [Surrealism](/gene/surrealism), whose followers like [Salvador Dalí](/artist/salvador-dali) and [René Magritte](/artist/rene-magritte) embraced chance, dreams, and the irrational in their quest to express the human subconscious. [Dada](/gene/dada) also embraced the fantastic in a more abstract manner, as exemplified by [Man Ray](/artist/man-ray) in his photographs and experimental films. Contemporary artists push the subject matter to even greater extremes, whether in [Kenny Scharf](/artist/kenny-scharf)'s swirling dreamscapes of donuts, fish, and teddy bears, or the imaginary intergalactic explorations of [Cai Guo-Qiang](/artist/cai-guo-qiang)'s gunpowder explosions.
",FALSE
4e60331de890b1000123f364,china,China,Geographic Regions,Artists who are from or who have lived in China.,TRUE
4eb411300253b8000100256d,single-object,Single Object,Visual Qualities,"",FALSE
4e31d72d59cd670001000008,personal-histories,Personal Histories,Subject Matter,"Used in describing works referring to a personal past, whether the artist’s or another individual’s, through memories, narratives, or experiences recalled or documented by the artist.",FALSE
4e5fe8e9e890b10001046154,contemporary-pop,Contemporary Pop,Styles and Movements,"When it emerged in the 1960s, [Pop art](/gene/pop-art) was not just about bold colors and celebrity culture; it brought the popular world—from cartoons and advertising to apples and bananas—into the realm of high art, turning taste on its head in the process. In the late 1980s, [Jeff Koons](/artist/jeff-koons), [Ashley Bickerton](/artist/ashley-bickerton), and a handful of mostly New York-based contemporary artists revived this sensibility, in a movement known informally as “Neo-Pop.”  The Pop aesthetic is now wide-spread and global; artists working in this vein combine everything from camp and tchotchkes to luxury and immortal materials. [Takashi Murakami](/artist/takashi-murakami)'s ebullient flowers or [Damien Hirst](/artist/damien-hirst)’s prescription drug-named dots toy with the line between low and high art while not shying away from themes of decadence and death. At times confrontational and provocative, at times irreverent and witty, Pop art—now as then—speaks to the objects and images of our everyday lives. Perhaps [Andy Warhol](/artist/andy-warhol) said it most presciently; when asked, in 1961, what Pop art is, he responded: “It's liking things.”",FALSE
4e6034a6e890b10001250c9e,switzerland,Switzerland,Geographic Regions,Artists who are from or who have lived in Switzerland.,TRUE
4e603b39e890b10001272235,southeast-asia,Southeast Asia,Geographic Regions,"Artists who are from or who have lived in Southeast Asia, which includes Brunei, Burma, Cambodia, East Timor, Indonesia, Laos, Malaysia, Philippines, Singapore, Thailand, and Vietnam.",TRUE
4e66d48cb607460001125c58,provocative,Provocative,Subject Matter,"_""I wanted a shark that's big enough to eat you, and in a large enough amount of liquid so that you could imagine you were in there with it."" —[Damien Hirst](/artist/damien-hirst), on_ The Physical Impossibility of Death in the Mind of Someone Living, _(1991)_

Used to describe artworks that arouse strong feelings, whether because of their subject matter or technique. In perpetually challenging artistic traditions, artists have confronted issues of sexuality, [race](gene/race), [politics](gene/politics), and [religion](gene/related-to-religion), and incorporated surprising materials such as dirt or bodily fluid into their works, often facing a backlash of rejection and fierce criticism from the public. To take examples from the history of Western art, in the mid-late 19th century [Gustav Courbet](artist/gustav-courbet) and [Édouard Manet](artist/edouard-manet) shocked a conservative public with paintings that irreverently combined incongruent imagery with modern painting techniques. In the 20th century artists like [Marcel Duchamp](artist/marcel-duchamp] and [Robert Rauschenberg](Robert-rauschenberg) continued to defy established notions of what constitutes “art” by deeming everyday objects suitable for inclusion in sculptures, or as art objects themselves. Shock value is inherent in many provocative works—take [Robert Mapplethorpe](artist/Robert-mapplethorpe)’s sexually-charged photographs from the 1970s and [Andres Serrano](artist/andres-serrano)’s depictions of homeless people, members of the Ku Klux Klan, and cadavers, as well as his 1989 _Piss Christ_.",FALSE
4e7ba52da29c99000104e936,cobra,CoBrA,Styles and Movements,"An international artist group active between 1948 and 1951 whose name is derived from the first letters of the capitals of the members’ native countries: Copenhagen, Brussels, and Amsterdam. In the wake of the destruction of World War II, CoBrA rejected Western culture and [Surrealism](/gene/surrealism)&mdash;the most influential prewar art movement&mdash;emphasizing instead experimentation and spontaneous expression and drawing inspiration from children’s drawings and the art of ‘primitive’ cultures.",FALSE
4e84a9c4ebc4320001002ae3,related-to-film,Related to Film,Subject Matter,"Artworks that depict actors, directors, memorabilia, or 
imagery related to the film industry. May also be used to describe work engaging with film history or theory.",FALSE
4e84cd78432230000100353d,multiple-exposure,Multiple Exposure,Medium and Techniques,"The combination of two or more photographs into one image. Most often, two exposures are used--the name for this technique being double exposure. ",FALSE
4ec078e67ae10a000100ca87,scattered-composition,Scattered Composition,Visual Qualities,"Scattered compositions contain multiple elements irregularly distributed across an artwork’s surface in many directions. While some artists might use [chance](/gene/chance) effect to determine where a paint dab might land on canvas, like many [Abstract Expressionists](/gene/abstract-expressionism), others have created the same dispersed style through careful and considered application, like [Sherrie Levine’s](/artist/sherrie-levine) knot works. This category applies not only to the seemingly random patterns found in two and three-dimensional artwork, but also dance and installation art, such as [Trisha Brown’s](/artist/trisha-brown) gravity-defying choreography for “Walking on the Wall” or [Robert Morris’](/artist/robert-morris) “Untitled (Scatter Piece),” featuring industrially-fabricated sculptures dispersed across a gallery floor.",FALSE
4e0ce88687b7d10001004332,bulbous,Bulbous,Visual Qualities,"A term applied to bulging, swollen or bulb-shaped forms and objects. One of the earliest known renderings of the human figure, the [Venus of Willendorf](/artwork/venus-of-willendorf), is one of the most often cited examples. Artists from [Peter Paul Rubens](/artist/peter-paul-rubens) to [Pablo Picasso](/artist/pablo-picasso) and [Fernando Botero](/artist/fernando-botero) have since experimented with hyper-rounded figures. Abstracted bulbous shapes as in the sculptures of [Jean Arp](/artist/jean-arp) and [Constantin Brancusi](/artist/constantin-brancusi) have also paved the way for a preponderance such forms in contemporary design, from the likes of [Maarten de Ceulaer](/artist/maarten-de-ceulaer) and [the Haas Brothers](/artist/the-haas-brothers).",FALSE
4e1b210467c8e10001002e47,related-to-toys,Related to Toys,Subject Matter,"Kids aren't the only ones preoccupied with toys. During the 20th century, particularly in movements such as [Dada](/gene/dada) and [Pop](/gene/pop-art), playthings have been depicted or used as a medium to reflect (both positively and negatively) on consumerism, youth, the fantastic, eroticism, nostalgia, or all of the above at once. And in contemporary digital and video art, one can witness a new engagement with virtual toys, especially video games.",FALSE
4e35ec031f6862000101036a,united-kingdom-and-ireland,United Kingdom and Ireland,Geographic Regions,"Artists who are from or have lived in the United Kingdom (Scotland, Wales, England, and Northern Ireland) or the Republic of Ireland.",TRUE
4e5ff542e890b100010800ee,hard-edged-1,Hard-Edged,Visual Qualities,"A term originating in the late 1950s for abstract paintings characterized by sharply defined geometric areas of flat colors conveying little or no depth, such as works by [Ellsworth Kelly](/artist/ellsworth-kelly), [Kenneth Noland](/artist/kenneth-noland), [Ad Reinhardt](/artist/ad-reinhardt), and [Barnett Newman](/artist/barnett-newman). In addition to historical paintings, this term can be used to describe the appearance of contemporary works as well as sculptures.",FALSE
4e5ff554e890b10001082fa4,molecular-1,Molecular,Visual Qualities,"Used in describing artworks containing forms resembling molecules, atoms, or other microscopic particles. ",FALSE
4e60120fe890b100011db876,topographic-photography,Topographic Photography,Medium and Techniques,"Technique in which a scene&mdash;usually a landscape&mdash;is photographed as if it were being surveyed from afar, practiced most famously by the 1970s [‘New Topographics’](/gene/new-topographics) photographers, including Robert Adams, Lewis Baltz, Nicholas Nixon, and [Bernd and Hilla Becher](/artist/bernd-and-hilla-becher). These artists inspired Becher's students at the Kunstakademie Düsseldorf, who in the 1990s composed the influential ""[Dusseldorf School](/gene/dusseldorf-school-of-photography),"" composed of such photographers as [Andreas Gursky](/artist/andreas-gursky) and [Thomas Struth](/artist/thomas-struth-2).",FALSE
4e60345be890b1000124efe0,latin-america-and-the-caribbean,Latin America and the Caribbean,Geographic Regions,Artists who are from or who have lived in Latin America or the Caribbean.,TRUE
4e6035e1e890b100012525ef,eastern-europe,Eastern Europe,Geographic Regions,"Artists who are from or who have lived in Eastern Europe, which includes Belarus, Bulgaria, the Czech Republic, Estonia, Hungary, Latvia, Lithuania, Poland, the Republic of Moldova, Romania, Slovakia, and Ukraine. ",TRUE
4e8f1aa004fef6000100177e,layered-images,Layered Images,Visual Qualities,"Artworks with distinct overlays of visual imagery. This layering can be achieved both through the physical build up of translucent mediums (such as paint or glass), or the artist's composition. [Barbara Kruger's _Untitled (EVIL)_](/artwork/barbara-kruger-untitled-evil), for example, superimposes a seemingly benign image of a woman's face with a word that is anything but, while [Ryan McGinness](/artist/ryan-mcginness) layers graphic icons to create a jumbled mash-up of forms—""random access memories,"" as he calls them.",FALSE
4e3adafd4d76300001000722,encaustic,Encaustic,Medium and Techniques,"_“A beautiful woman leaves in the heart of an indifferent man an image as fleeting as a reflection on water, but in a lover’s heart, the image is fixed with fire like an encaustic painting that time will never erase.” —Plutarch_

It is not clear exactly when encaustic (from the Greek enkaustikos, “to burn in”) was first used, but some of the earliest surviving examples date from as far back as the 1st century BC. Originally referring to a specific process of using heat to fuse beeswax with pigment and resin, encaustic has become a more general term for the use of wax and painting in tandem. Because of its durability, encaustic was most likely first used by the Greeks in order to waterproof and decorate ships, but eventually found its way into more traditional forms of art. After the fall of the Byzantine empire, where the medium appears in many religious icons, encaustic largely disappeared until the 18th century when it was used by artists trying to imitate Greek and Roman Art. In the 20th century, encaustic is most often associated with the work of [Jasper Johns](/artist/jasper-johns), who used it in his Flag paintings, the first of which was displayed in 1955. Because of its versatility, other artists, such as [Martin Kline](/artist/martin-kline), [Brice Marden](/artist/brice-marden), and [Lynda Benglis](/artist/lynda-benglis), continued to work with encaustic throughout the 20th century and into the present day.",FALSE
4e0ce8655695820001004166,dense-composition,Dense Composition,Visual Qualities,"Similar to “horror vacui,” a Latin-derived term for “fear of empty spaces,” compositions in this category cover the entire surface of a work with [highly-detailed](/gene/highly-detailed) visual content.  The art of filling empty spaces dates back to Ancient Egyptian hieroglyphs, Greco-Roman friezes, and South Asian miniature paintings, where picture planes would overflow with [interlaced bodies](/gene/interlaced-bodies).  Centuries later, [Northern Renaissance](/gene/northern-renaissance) artists like [Hieronymus Bosch](/artist/hieronymus-bosch) and [Albrecht Dürer](/artist/albrecht-durer) would execute complex compositions with little negative space between their meticulously-rendered figures.  Symbolically and physically dense designs can be found in contemporary art as well, from the totemic assemblages of [Vanessa German](/artist/vanessa-german) to the wheatpaste wall installations of [Swoon](/artist/swoon).",FALSE
4e1b05137082620001000019,grid,Grid,Visual Qualities,"A general category for both two- and three-dimensional artworks incorporating a grid or lattice structure in some fashion. Artworks with grids in them are most often abstract and are geometrically precise. The grid is usually associated with the work of 1960s Minimalist and Conceptual artists, such as [Sol LeWitt](/artist/sol-lewitt), [Carl Andre](/artist/carl-andre), and [Donald Judd](/artist/donald-judd), and was generally used to create an un-hierarchical composition, absent of traditional imagery or meaning.",FALSE
4e5ffabde890b1000108f479,stolen-moments,Stolen Moments,Subject Matter,Images and scenes involving unknown passersby seemingly captured without the permission of the subject.,FALSE
4e5708875dca140001003a8f,group-of-portraits,Group of Portraits,Subject Matter,"Artworks that comprise a series of portraits, like those of [Andy Warhol](/artist/andy-warhol), who depicted in individual works the same person as many as 36 different times. ",FALSE
4e5708a6265ad10001001d94,portraits-without-a-face,Portraits without a Face,Subject Matter,"In 1991, the Cuban-American artist [Felix Gonzalez-Torres](https://www.artsy.net/artist/felix-gonzalez-torres) exhibited _Untitled (Portrait of Ross in L.A.)_, a 175 pound-pile of wrapped candy that viewers could pick from and eat. While the interactive sculpture did not render a person’s face or body, it has been interpreted as a portrait representing the ideal weight of the artist’s partner who died of complications from AIDS that same year. Gonzalez-Torres, among many others, have expanded the definition of portraiture to include artworks that capture the essence of individuals, without rendering their physical likenesses. For example, in _[Portrait of a German Officer](https://www.artsy.net/artwork/marsden-hartley-portrait-of-a-german-officer)_ (1914), American Modernist [Marsden Hartley](https://www.artsy.net/artist/marsden-hartley) depicted the fallen soldier Karl von Freyburg exclusively through abstract symbols, such as the lieutenant’s initials, age of death, and military awards. Feminist artist [Judy Chicago](https://www.artsy.net/artist/judy-chicago) designed unique place settings to represent thirty-nine historic women in her seminal work _[The Dinner Party](https://www.artsy.net/artwork/50328e312b117f0002000827)_ (1974-79); and photographer [Coke Wisdom O'Neal](https://www.artsy.net/artist/coke-wisdom-oneal) documented the medicine cabinets of friends and strangers, presenting these private spaces as individual portraits in and of themselves.",FALSE
4e8c9ef7b86a570001003835,interactive,Interactive,Medium and Techniques,"Artworks that necessitate the participation of viewers. Examples could be works of [performance art](/gene/performance) in which an artist requires the active involvement of audience members, or [sculptures](/gene/sculpture) that can be touched and/or played with. Some Interactive Art incorporates computer technology and may take the form of an interactive [website](/gene/website) or digital interface. Artists associated with [Relational Aesthetics](/gene/relational-aesthetics) are also known to create interactive objects and situations.",FALSE
4e9742cca2000000010016e2,multiple-screens,Multiple Screens,Medium and Techniques,"[Videos or films](/gene/film-slash-video) that include more than one screen or projection. While recent technological advancements in film, video production, and presentation have encouraged the use of multiple screens, artists like [Nam June Paik](/artist/nam-june-paik-1) have employed more than one screen to present work since video art was first recognized in the [1960s](/gene/1960s).",FALSE
