id,slug,gene name,gene family,description,automated?
51f1c32b275b24b49d000020,19th-century-german-realism,19th Century German Realism,Styles and Movements,"A term often used to describe a number of German artists from roughly 1850 to 1900 that broke with the dominant Romantic trend to work in a dispassionate, realistic style. Rejecting the emotional intensity of artists like [Caspar David Friedrich](/artist/caspar-david-friedrich), these realists gravitated towards scenes of everyday life and investigations into the nature of reality. As keen observers of social interaction, they portrayed both rural and urban scenes, as well as the fashions of the newly emerging urban bourgeoisie. German Realism was not a coherent movement: it emerged alongside other national schools of realism (most prominently [19th Century French Realism](/gene/nineteenth-century-french-realism)) and was characterized by a broad array of individual styles. Adolph Menzel’s _The Iron Rolling Mill_ (1875) depicts a crowd of iron workers toiling over a hot furnace; it combines intense chiaroscuro with impressionistic passages of smoke. The much younger [Max Liebermann](/artist/max-liebermann), in contrast, painted airy scenes of beaches and parks with looser brushwork and a focus on light effects, which elicited comparisons to French Impressionism.",FALSE
51f7df77275b246a330002fc,greek-and-roman-art-and-architecture,Greek and Roman Art and Architecture,Cultural and Religious Styles,"The art and architecture of ancient Greece and Rome played a foundational role of the history of Western art, establishing numerous key concepts, techniques, and styles that artists in the subsequent millennia have revisited and responded to in countless ways. These include precise techniques for carving and casting free-standing sculptures and the undertaking of large-scale urban building projects, which stemmed from access to and the skilled use of materials ranging from marble to bronze to concrete. “Man is the measure of all things” was a central maxim in Greek culture, and as such, Greek artists scrutinized human forms closely to create idealized Classical figures. They also presented detailed depictions of mythological narratives, which often accentuated the human traits of the pantheon of gods. Roman artists borrowed heavily from these narratives, while contributing many of their own. These developments in art were accompanied by new forms of political life, most notably the form of democracy that emerged in Athens and reached its height during the 5th century BC (the Parthenon was built 447-432 BC). Athens and its neighbors in the eastern Mediterranean participated in a seafaring culture that resulted in a great amount of cultural and economic exchange. Under the Roman Empire (27 BC-395 AD), territories stretching from the present-day Middle East to Scotland were brought under centralized rule. Beginning in the 4th century, cultural and political power shifted to the east of the empire, with Constantinople becoming the capital in 330 and much of the western territory falling into the hands of northern European conquerors thereafter. Around this time, Christianity began to supplant pagan religion—at first persecuted by the state but in the 4th century becoming the official religion under Constantine, which led to the growth of a new body of iconography that would flourish in [Byzantine Art](/gene/byzantine-art).",TRUE
52163b6b275b247644000211,timber-frame-construction,Timber Frame Construction,Design Concepts and Techniques,"",FALSE
52163aea8b3b81872b000212,masonry-construction,Masonry Construction,Design Concepts and Techniques,"Any building whose construction is primarily made of a combination of stones or bricks, with or without mortar. Most of the earliest-known buildings are masonry structures of some kind. The Egyptians took masonry construction to (literally) new heights. [The Great Pyramid of Giza](/artwork/great-pyramids-fourth-dynasty) was the tallest man-made structure for 3,800 years until the appearance of Gothic cathedrals. In the 18th and 19th centuries, steel beams and cast iron encouraged masonry elements to become decorative. The predominant use of glass has further solidified this.",FALSE
5266f899cd530eb849000222,migration,Migration,Subject Matter,"Human migration, which encompasses diaspora, exile, immigration, and emigration, is a significant aspect of world history that has shaped the ethnic, religious, and cultural identities we know today. In recent years, large numbers of migrant workers from South and Central America and the Caribbean have traveled to the United States, while the Mediterranean Sea has seen thousands of migrants traveling from northern Africa to Europe. Many contemporary artists address the global scope of migration and its personal and political consequences: the French collective Claire Fontaine has installed a neon sign reading “Foreigners Everywhere” in various translations in numerous locations worldwide, drawing attention to the universal concern with immigration. [Alfredo Jaar](/artist/alfredo-jaar)’s One Million Finnish Passports (1995) references the total number of citizenship applications rejected by Finland, bringing attention to the impact of stringent citizenship policies in the EU. Other important examples of migration in art include [Titian](/artist/titian)’s strikingly large-scale 1514 woodblock print, [The Submersion of the Pharaoh’s Army in the Red Sea](/artwork/titian-the-submersion-of-pharaohs-army-in-the-red-sea), which represents a key scene in the escape of the Israelites from Egypt in the Old Testament. [Jacob Lawrence](/artist/jacob-lawrence)’s 60-panel narrative painting series, “The Migration of the Negro” (1940–41), documents the Great Migration, in which 6 million African Americans relocated to Northern cities from the rural South between 1910 and 1970. 
",FALSE
52530cba8b3b81b3fe000083,censorship,Censorship,Subject Matter,"Artworks that take censorship—the act of prohibiting something from being read, heard, or seen—as their subject matter. Throughout history, governments, leaders, and communities have censored art and culture as a means of control, often targeting [religious icons](/gene/deities-and-holy-figures), [political](/gene/political) subject matter, or the [human form](/gene/human-figure), especially [nudity](/gene/nude). Not surprisingly, many artists directly address issues of censorship in their work. For example, [Jenny Holzer](/artist/jenny-holzer) created a series of paintings that document redacted government materials. Dissident Chinese artist [Ai Weiwei](/artist/ai-weiwei) has exposed the Chinese government’s campaign of misinformation and massive cover-up of the 2008 Sichuan earthquake with his work _[Straight](/artwork/ai-weiwei-straight)_, for which he painstakingly straightened 150 steel rods salvaged from the ruins of a school that collapsed during the national tragedy.
",FALSE
5266fafdcd530e8bba00025c,related-to-hip-hop,Related to Hip-Hop,Subject Matter,"Artworks or design objects that have some relationship to hip-hop or rap music, which began in the Bronx, in New York City, in 1973. Examples could be depictions of rappers (such as Jay-Z or Slick Rick); [fashion](/gene/related-to-fashion) identified with rap (such as gold chains, ostentatious basketball sneakers, or “pimped” cars); or other aspects of hip-hop culture, such as DJs and breakdancing.",FALSE
520bde84139b21746800044d,restrained-forms,Restrained Forms,Design Concepts and Techniques,"",FALSE
521b85ffa09a671b30000149,skyscapes,Skyscapes,Subject Matter,"_“My greatest dream is the projection of light into the vast night sky, the probing of the universe as it meets the light, untouched, without obstacles—the world of space is the only one to offer man practically unlimited freedom.”—[Otto Piene](/artist/otto-piene)_

A category for artworks that emphasize images of the sky. The environment above us and its infinite variations of colors, clouds, sunrises, and sunsets—as well as the birds, planes, satellites, and drones that occupy it—have proven endlessly fascinating to artists.",FALSE
52277c7debad644d2800051f,abstract-expressionism,Abstract Expressionism,Styles and Movements,"_“It seems to me that the modern painter cannot express this age, the airplane, the atom bomb, the radio, in the old forms of the [Renaissance](/gene/renaissance) or of any other past culture.” —Jackson Pollock_

Abstract Expressionism signaled a new age of American artistic expression in the immediate postwar period (the late 1940s and 1950s). Though never a formal movement or school, “AbEx” grouped together artists—including [Jackson Pollock](/artist/jackson-pollock), [Willem de Kooning](/artist/willem-de-kooning), [Mark Rothko](/artist/mark-rothko), and [Clyfford Still](/artist/clyfford-still), amongst others—with interest in spontaneity, monumental size, the individual psyche, and universal expressions of feeling. Historically, AbEx has been broken into two tendencies: Gestural Abstraction (or Action Painting), which emphasized the energy of the painter’s mark, and [Color Field Painting](/gene/color-field-painting), which focused on the creation of vast, seemingly floating areas of color. The rise of Abstract Expressionism has been attributed to the influence of European movements like [Cubism](/gene/cubism) and [Surrealism](/gene/surrealism), which reached New York in the 1930s and ’40s via museum exhibitions, academic institutions, and the stateside relocation of many major European artists due to World War II.",FALSE
52277c8eebad644d28000523,minimalism,Minimalism,Styles and Movements,"One of the most important and influential art styles of the 1960s, Minimalism identifies works of art most often comprised of geometric shapes in simple arrangements and lacking any decorative or dynamic flourishes. These geometric shapes characterized the elemental or “bare bones” forms of art, which, according to critics, represented the culmination of modern art's progression toward the most simplified form of abstract art possible. [Donald Judd](/artist/donald-judd), [Dan Flavin](/artist/dan-flavin), and [Carl Andre](/artist/carl-andre) are among the best-known artists associated with Minimalism, which is characteristically associated with sculpture rather than painting. Minimalism’s roots arguably lie in Russian [Constructivism](/gene/constructivism), the paintings of postwar American artists such as [Barnett Newman](/artist/barnett-newman), [Ad Reinhardt](/artist/ad-reinhardt), and [Frank Stella](/artist/frank-stella), and the formalist theories of Clement Greenberg. Initial labels for Minimalism—none of which became popular—were ""ABC Art"" and ""Primary Structures"" (the latter was the title of one of the first organized exhibitions of Minimalist works).",FALSE
5238cb9aa09a67af5c00028c,fractal-like-slash-kaleidoscopic,Fractal-like / Kaleidoscopic,Visual Qualities,"Artworks with an incredible level of compositional complexity, often achieved through the use of intricate, all-over patterns that disorient or cause the eye to flit about, as with the infinitely repeating patterns of fractals or kaleidoscopes. This effect is sometimes referred to as “horror vacui”, Latin for “fear of empty space”, as such detailing fills an entire surface or artwork, leaving no room for negative space or unadorned passages. Ebullient patterning and dizzying complexity is a hallmark of Islamic art and architecture, of which the [Muqarnas Dome at Alhambra](/artwork/muqarnas-dome-hall-of-the-abencerrajes-palace-of-the-lions-alhambra) in Grenada, Spain, is an iconic example.",FALSE
5266f8c0a09a67eac500028a,utopia,Utopia,Subject Matter,"A utopia refers to an imagined, perfect society, a concept that exists in religions and cultures throughout the world, from the Christian heaven to the Tibetan earthly paradise, Shangri-La. The word “utopia” derives from Thomas Moore's fictional account, in 1516, of an idealized island community of the same name. Artists and architects have since attempted to employ urban planning and the arts to visualize or create livable utopias. [Le Corbusier](/artist/le-corbusier), for example, envisioned a new type of urbanism, one in which living and working took place in separate spheres, and modern highways replaced the dark, crowded slums of the old European city. “Modernity was the time of desire for utopia,” the philosopher Boris Groys has said, and indeed many consider modern architecture and urban planning of the 20th century to have failed the pressing societal issues of the day. Contemporary artists often examine past utopian ideologies critically, such as [David Maljkovic](/artist/david-maljkovic) or [Mark Titchner](/artist/mark-titchner), while others attempt to create ideal communities in the here-and-now through performance or socially engaged work.
",FALSE
5266fc609c18dbb47e0002d8,collaborations-and-collectives,Collaborations and Collectives,Styles and Movements,"Some of the most creative outpourings in art history have taken place through artistic collaboration. [Pablo Picasso](/artist/pablo-picasso) and [Georges Braque](/artist/georges-braque) worked closely between 1908 and 1914 to forge the [Cubist](/gene/cubism) style, and the works staged jointly by [Marina Abramović](/artist/marina-abramovic-1) and [Ulay](/artist/ulay) revolutionized [Performance Art ](/gene/performance-art) in the 1970s. An artist collective is a defined group of creatives who work together towards a similar goal, united by political, economic, professional, or historical circumstances. More visible as a group, collectives offer a pragmatic way to create impact through large-scale projects and exhibitions. Many art collectives like Critical Art Ensemble, Gran Fury, and Tucuman Arde are grounded in political activism. The [Guerilla Girls](/artist/guerrilla-girls) and [Spiral](/gene/spiral-group), for example, are collectives that advocate for women and minorities in the arts. ",FALSE
5266f96a8b3b81ab780002e1,beijing-east-village,Beijing East Village,Styles and Movements,"In the early 1990s, a group of avant-garde artists formed a collective in a dilapidated village on the outskirts of Beijing, dubbing it the East Village after the New York City neighborhood. There, distanced from the rest of the Beijing art world, artists such as [Zhang Huan](/artist/zhang-huan), Li Guomin, and Ma Liuming experimented with stomach-turning feats of [performance art](/gene/performance-art). Zhang famously sat for hours, motionless and covered in honey, in a squalid, fly-infested outhouse for his work _12 Square Meters_ (1994). Beijing East Village artists collaborated on performances that probed the relationship between the human body, the natural landscape, and the urban environment. The photographer [Rong Rong](/artist/rong-rong) documented many of these works and the artists’ daily lives, and it is largely through his images that the group's ephemeral creations are known. Though the Beijing East Village officially ended with a police raid and a forced eviction in 1994, their legacy continues to resonate with many Chinese contemporary artists.",FALSE
5266fa38b202a329ee00024d,kawaii,Kawaii,Subject Matter,"_Kawaii_ is a Japanese concept best translated as “cuteness.” Epitomized by [Manga](/gene/manga) comics, Hello Kitty merchandise, and the Pokémon franchise, the _kawaii_ aesthetic is a prominent aspect of Japanese [popular culture](/gene/popular-culture). [Takashi Murakami](/artist/takashi-murakami)—often called the “Japanese [Andy Warhol](/artist/andy-warhol)”—merges _kawaii_ with fine art through his own cast of recurring characters that include a smiling [flower](/artwork/takashi-murakami-rainbow-flower-4-oclock) and a wide-eyed, anime-inspired creature called [Mr. DOB](/artwork/takashi-murakami-and-then-dot-dot-dot-blue-1). Other contemporary Japanese artists, such as [Yoshitomo Nara](/artist/yoshitomo-nara), have critiqued the cuteness of _kawaii_ with works that reflect a darker, more complex interpretation of its superficial (and exaggeratedly feminine) qualities. ",FALSE
52163b28275b24e7d0000212,steel-slash-iron-frame-construction,Steel/Iron Frame Construction,Design Concepts and Techniques,"Iron and steel frame construction allowed engineers to design structures that soared to yet unimagined heights. The Eiffel Tower, an iron latticework structure, premiered at the 1889 Paris World’s Fair and redefined structural verticality. This continues to be the most prominent structural type in large scale contemporary architecture.",FALSE
5266fd05139b215d95000282,related-to-punk,Related to Punk,Subject Matter,"Emerging in the 1970s as a subcultural phenomenon spanning music, fashion, and art, punk promulgated an ethos and a way of life that were anti-authoritarian, exuberantly deskilled, and staunchly DIY. In London and New York, vibrant, collaborative scenes emerged: Malcolm McLaren and Vivienne Westwood’s shop, Seditionaries, outfitted the Sex Pistols for their first gig in 1975. The East Village’s alternative space Colab, founded in 1977, featured punk and new wave performances and hosted artists such as [Jenny Holzer](/artist/jenny-holzer) and [Kiki Smith](/artist/kiki-smith), while street artists [Keith Haring](/artist/keith-haring) and [Jean-Michel Basquiat](/artist/jean-michel-basquiat) were involved with the scene at the Mudd Club. Punk quickly became a benchmark for authenticity and the ultimate in cool, making it a target for appropriation by precisely those forces—high culture, consumerism, authority—it sought to resist. Some have traced its attitude and focus on destruction to the [Dada](/gene/dada) movement of the early 20th century, understanding it as a type of anti-art disdaining visual and cultural norms as gatekeepers to participation. Many of punk’s founders came from working class backgrounds, and some explicitly aligned punk with this group’s political interests, an alliance that posed a particular challenge to punk’s relationship to fine art, traditionally the realm of high culture. ",FALSE
51f1c391275b24b49d000024,danube-school,Danube School,Styles and Movements,"Refers to a group of German and Austrian painters active around Regensburg, Germany between the late 15th and early 16th centuries, during a period often referred to as the [Northern Renaissance](/gene/northern-renaissance). Although these artists never formed an official school—many were itinerant—their output during this period is marked by prominent stylistic traits. [Lucas Cranach](/artist/lucas-cranach-the-elder), who is credited as the father of the Danube School, produced work whose characteristic linearity, warm color palette, and lively depictions of nature would become hallmarks of painting in this region. Within European art history, the Danube School pioneered the landscape as an autonomous theme, as characterized by one of the school's most prominent practitioners [Albrecht Altdorfer](/artist/albrecht-altdorfer), and, in figurative paintings, focused on achieving glowing, ivory skin tones in supple-looking bodies. With their emphasis on the relationship of humans to nature and their recurring imagery of fairytale-like forests, the Danube School artists, along with [Albrecht Düre](/artist/albrecht-durer)r, who influenced their work, would come to serve as symbols of German identity for future generations of artists.",FALSE
51f1a278275b243b7b0007bc,bentwood,Bentwood,Medium and Techniques,"A process that involves wetting or steaming wood, bending it, and letting it dry and harden into a curved shape. This technique has used been all over the world for thousands of years; some First Nations people of the Pacific Northwest made bentwood boxes by steaming and bending a single piece of wood; traditional uses of these varied from storing food and clothing to serving burial purposes. The [Thonet Brothers](/artist/thonet-brothers) (est. 1843) developed the first industrial-scale production processes for bentwood; their [Side Chair](/artwork/thonet-brothers-side-chair-production-no-19) is an iconic example of the technique.
",FALSE
52163bc78b3b81da7f000229,reinforced-concrete-construction,Reinforced Concrete Construction,Design Concepts and Techniques,"Although concrete has been prized for millennia in architecture for its weight-bearing strength, the addition of steel reinforcing bars (“rebar”) to improve the material’s tensility was first developed during the mid-19th century in France. Since concrete can be poured and metal can be bent into any shape, many architects have taken advantage of this versatile and cost-effective material to construct complex structures. Beginning in the early 20th century, the Belgian architect Auguste Perret (with the help of his brothers, Gustave and Claude) built the world’s first reinforced concrete apartment block at 25 rue Franklin, in Paris. The unparalleled strength of reinforced concrete meant that fewer structural supports were needed, which allowed Perret to use large windows on the facade to let in more light and to create more open space on each floor. Many iconic buildings of the 20th and 21st centuries have since been built using reinforced concrete construction, including [Frank Lloyd Wright](/artist/frank-lloyd/wright)’s Solomon R. Guggenheim Museum, in New York; [Le Corbusier](/artist/le-corbusier)’s Villa Savoye, in Paris; and the Burj Khalifa (currently the world’s tallest building), in Dubai.
",FALSE
5266f2b98b3b8161170001f4,use-of-vintage-imagery,Use of Vintage Imagery,Materials,"Late 19th-century botany books, vintage pin-ups, antique maps, circus posters, and etchings of once-novel machines like the phonograph or stereoscope—these relics of past visual cultures fascinate many artists working today. This tendency has its roots in the work of American collagist [Joseph Cornell](/artist/joseph-cornell), who in the 1930s frequented used bookstores and antique shops in search of arcane printed matter and historical curios for his works. Emerging from a tendency toward [assemblage](/gene/assemblage) in 1950s San Francisco, [Bruce Conner](/artist/bruce-conner), long an enthusiast of popular art from the late 19th century, created a series of collages that brought together vintage printed sources. From the “twee,” old-timely world of filmmaker Wes Anderson to the popularity of cursive fonts and handle-bar mustaches, this antiquarian sensibility continues to resonate in contemporary culture at large.
",FALSE
5266f6c2275b2414e300025b,southern-gothic,Southern Gothic,Subject Matter,"Southern Gothic—a term taken from an established tradition in American Literature—is a category for artworks that feature themes and images drawn from the dark corners of the American South. From the grotesque masked figures present in [Ralph Eugene Meatyard](/artist/ralph-eugene-meatyard)’s black-and-white photographs to the antebellum ruins of photographer [Sally Mann](/artist/sally-mann)'s images, such works might evoke folklore, oral history, local communities, concepts of the abnormal, and plantation life. Work from contemporary and modern artists, predominantly photographers like [Alec Soth](/artist/alec-soth) and [Walker Evans](/artist/walker-evans), might also capture the dark landscape of the American South—its overgrown yards, decaying mansions, paint-peeled front porches and quiet corner stores that bear the traces of the region’s historical scars.",FALSE
5266f814b202a329ee000246,orientalism,Orientalism,Styles and Movements,"The literary theorist Edward Said conceived the term “Orientalism” in his book, _Orientalism: Western Concepts of the Orient_ (1978). Said’s critique of European discourses that generalized “the Orient”—encompassing North Africa, present-day Turkey and the Middle East—as a unified and relatively primitive racial, geographic, political, and cultural region launched the field of postcolonial studies. As an artistic style, Orientalism is seen to have emerged in the wake of Napoleon Bonaparte’s late 18th century conquests in North Africa as the visual counterpart to the invention of the oriental “other”. Popularized in 19th-century French and British Romantic, as well as Neoclassical, painting, the Orientalist style is characterized by patterns inspired by eastern textiles and architecture, studies of ethnic subjects, and exotic images of the Near East.
",FALSE
5266fddfa09a671e0d00022a,digital-as-manual,Digital as Manual,Medium and Techniques,"Manually created artworks that employ the visual appearance or processes of digital technology. While the aesthetics of digital technology evolve as rapidly as technology itself, common characteristics include pixilation, color gradients, or manually rendered memes. James Bridle has coined the term “The New Aesthetic,” referring to what he calls an “eruption of the digital into the physical.” Works like _Flaming Bluetooth Sculpture_ by the collaborative duo AIDS-3D, or Patrick Lichty’s textile renditions of computer game graphics and “LOL” cat memes, take aspects of digital aesthetics and reproduce them in more traditional media. Perhaps the earliest example of this tendency dates back to [Thomas Bayrle](/artist/thomas-bayrle)’s “super-forms”—paintings, collages, or photographs composed of pixel-like, serial cells based on his early experiments with computer graphics in the 1970s.",FALSE
520bddb6139b219d4400045d,vacant-and-vacated-spaces,Vacant and Vacated Spaces,Subject Matter,"Images of interior and exterior spaces in which people are absent. Common examples include deserted towns, abandoned buildings, and parking lots.

",FALSE
